profile_id,name,sector,skills,interests,current_industry
1,Person 1,Finance & Banking,"Insurance Underwriting, Financial Analysis","FinTech Innovation, Venture Capital",Private Equity
2,Person 2,Healthcare & Life Sciences,"Occupational Therapy, Pharmaceutical Development","Medical Research, Health Informatics, Bioethics",Telemedicine
3,Person 3,Energy & Utilities,"Environmental Compliance, Power Generation, Water Resource Management, Wind Energy","Climate Change Mitigation, Oil & Gas Exploration, Water Resource Management",Water Management
4,Person 4,Education & Training,"Student Advising, Corporate Training, Educational Technology, Classroom Management","Language Learning, Curriculum Development, Vocational Training",Corporate Training
5,Person 5,Transportation & Logistics,"Rail Transport, Customs Brokerage, Logistics Analysis, Inventory Control, Cold Chain Logistics","Freight Management, Maritime Logistics, Cold Chain Logistics, Logistics Optimization",Maritime
6,Person 6,Education & Training,"Teacher Training, Tutoring, Instructional Design, Vocational Training","Educational Research, Vocational Training",Vocational Training
7,Person 7,Hospitality & Travel,"Reservation Management, Bartending, Restaurant Management, Travel Coordination","Culinary Arts, Cruise Tourism, Travel Writing",Hotels & Resorts
8,Person 8,Consumer Goods & Retail,"Product Management, Retail Management, Retail Analytics, Customer Service, Visual Merchandising","Packaging Design, Luxury Goods, E-commerce, Customer Experience Design",Consumer Electronics
9,Person 9,Real Estate & Construction,"Real Estate Development, Real Estate Investment, Commercial Real Estate, Contract Negotiation, Green Building","Real Estate Law, Residential Real Estate",Property Management
10,Person 10,Legal & Compliance,"Fraud Prevention, Litigation Support, Tax Law","Legal Research, Intellectual Property",Intellectual Property Law
11,Person 11,Education & Training,"Curriculum Assessment, Special Education, Tutoring, Education Policy","Language Learning, Corporate Training, E-learning",Language Learning
12,Person 12,Transportation & Logistics,"Third-Party Logistics (3PL), Logistics Analysis, Cold Chain Logistics","Urban Transit, Smart Cities, Route Optimization, Freight Management",Freight Forwarding
13,Person 13,Hospitality & Travel,"Food & Beverage Management, Hospitality Marketing, Travel Planning, Culinary Arts","Cruise Tourism, Luxury Travel, Recreation & Leisure, Event Management",Casino & Gaming
14,Person 14,Engineering & Manufacturing,"Thermodynamics, Plant Operations, Supply Chain Management","Product Design, Electrical Systems, Automotive Design, Material Science",Aerospace
15,Person 15,Legal & Compliance,"Arbitration, Corporate Governance","Arbitration, Intellectual Property, Human Rights Law, Contract Negotiation",Compliance & Risk Management
16,Person 16,Energy & Utilities,"Wind Energy, Geophysics","Environmental Sustainability, Renewable Energy, Oil & Gas Exploration",Water Management
17,Person 17,Hospitality & Travel,"Hospitality Marketing, Hospitality Management","Culinary Arts, Adventure Travel, Event Management",Food & Beverage Services
18,Person 18,Agriculture & Food Production,"Dairy Farming, Fisheries Management, Agricultural Engineering","Organic Farming, Agroforestry, Fisheries Management, Food Safety",Fisheries
19,Person 19,Finance & Banking,"Accounting, Financial Analysis, Forecasting, Underwriting","Investment Strategies, Personal Finance, Financial Planning",Financial Services
20,Person 20,Energy & Utilities,"Mining Engineering, Geophysics, Wind Energy, Waste Management","Energy Auditing, Energy Policy, Sustainable Development",Electricity Generation
21,Person 21,Hospitality & Travel,"Airline Management, Restaurant Management","Hotel Management, Recreation & Leisure, Sustainable Tourism",Cruise Lines
22,Person 22,Engineering & Manufacturing,"Production Planning, Automation Engineering","Renewable Energy, Automotive Design, Manufacturing Processes, Product Design",Product Design
23,Person 23,Transportation & Logistics,"Logistics Coordination, Supply Chain Optimization, Route Planning, Inventory Control, Shipping & Receiving","Railway Systems, Automotive Engineering",Transportation Planning
24,Person 24,Agriculture & Food Production,"Supply Chain Management in Agriculture, Rural Development, Organic Farming, Food Safety","Organic Farming, Fisheries Management, Urban Farming",Crop Science
25,Person 25,Finance & Banking,"Forecasting, Underwriting","Cryptocurrency, Venture Capital",Corporate Finance
26,Person 26,Energy & Utilities,"Sustainability, Drilling Engineering, Oil & Gas Exploration","Energy Conservation, Renewable Energy, Environmental Sustainability, Oil & Gas Exploration",Nuclear Energy
27,Person 27,Media & Entertainment,"User Engagement, Content Creation, Scriptwriting, Sound Engineering, Animation","Digital Media, Social Media Content, Journalism",Public Relations
28,Person 28,Media & Entertainment,"Scriptwriting, Advertising","Podcasting, Performing Arts, Videography",Journalism
29,Person 29,Finance & Banking,"Equity Research, Financial Regulations","Personal Finance, Real Estate Investment",Wealth Management
30,Person 30,Legal & Compliance,"Arbitration, Patent Law, Regulatory Compliance, Ethics & Compliance","Intellectual Property, Contract Negotiation, Employment Law, Environmental Law",Environmental Law
31,Person 31,Transportation & Logistics,"Logistics Coordination, Logistics Analysis","Route Optimization, Supply Chain Management, Cold Chain Logistics",Shipping
32,Person 32,Technology & IT,"UX Design, IT Support, User Interface Design, UI Design","Data Science, Digital Transformation",Machine Learning
33,Person 33,Engineering & Manufacturing,"Electrical Engineering, Lean Manufacturing","Electrical Systems, Mechanical Design, Aerospace Technology, Automotive Design",Manufacturing
34,Person 34,Agriculture & Food Production,"Plant Breeding, Pest Management, Organic Farming, Crop Management, Agricultural Engineering","Agribusiness, Organic Farming, Livestock Management, Crop Science",Livestock Management
35,Person 35,Agriculture & Food Production,"Rural Development, Sustainable Agriculture, Crop Management","Irrigation Systems, Organic Farming, Sustainable Agriculture, Agribusiness",Organic Farming
36,Person 36,Education & Training,"Curriculum Assessment, Tutoring, Assessment Design, E-learning Development, Teacher Training","Lifelong Learning, Student Mentorship",Educational Technology
37,Person 37,Hospitality & Travel,"Cruise Management, Travel Writing","Hotel Management, Cultural Tourism, Hospitality Innovation, Culinary Arts",Hospitality Management
38,Person 38,Agriculture & Food Production,"Plant Breeding, Livestock Management, Horticulture, Food Processing","Permaculture, Food Safety, Crop Science, Sustainable Agriculture",Dairy Farming
39,Person 39,Transportation & Logistics,"Logistics Engineering, Shipping & Receiving, Fleet Management, Cross-Docking, Maritime Operations","Freight Management, Route Optimization, Cold Chain Logistics",Trucking
40,Person 40,Energy & Utilities,"Wind Energy, Geophysics","Waste Management, Climate Change Mitigation",Utilities
41,Person 41,Transportation & Logistics,"Urban Transit Planning, Freight Forwarding, Logistics Analysis, Customs Brokerage","Transport Policy, Urban Transit",Freight Forwarding
42,Person 42,Education & Training,"Career Counseling, Tutoring, Student Advising","Vocational Training, STEM Education, Educational Policy, Curriculum Development",Curriculum Development
43,Person 43,Government & Non-Profit,"Public Relations, Legal Compliance, Urban Planning, Legislative Affairs, Public Speaking","Social Justice, Human Rights Advocacy, Community Development, Public Policy",Public Administration
44,Person 44,Media & Entertainment,"Sound Engineering, Media Planning, Campaign Management, Scriptwriting, Animation","Animation, Cultural Events",Public Relations
45,Person 45,Finance & Banking,"Asset Management, Insurance Underwriting","Portfolio Management, Corporate Finance, Stock Market, Personal Finance",Wealth Management
46,Person 46,Agriculture & Food Production,"Food Safety, Agroforestry","Agroforestry, Irrigation Systems",Livestock Management
47,Person 47,Engineering & Manufacturing,"Thermodynamics, Circuit Design, Six Sigma, Robotics, HVAC Engineering","3D CAD Modeling, Robotics Engineering",Manufacturing
48,Person 48,Engineering & Manufacturing,"HVAC Engineering, Material Science, Control Systems, Industrial Design","Quality Control, Electrical Systems, Mechanical Design",Process Engineering
49,Person 49,Engineering & Manufacturing,"3D Printing, CAD Design","Nanotechnology, Robotics Engineering, Mechanical Design, 3D CAD Modeling",Civil Engineering
50,Person 50,Education & Training,"Teaching, Student Advising, Education Policy, Corporate Training","Inclusive Education, EdTech Innovation",Corporate Training
51,Person 51,Transportation & Logistics,"Cold Chain Logistics, Logistics Analysis, Warehouse Management, Import/Export Management, Transportation Management Systems (TMS)","Route Optimization, Supply Chain Management",Aviation
52,Person 52,Finance & Banking,"Financial Reporting, Financial Analysis, Financial Modeling, Credit Analysis","Real Estate Investment, Cryptocurrency, Portfolio Management",Wealth Management
53,Person 53,Healthcare & Life Sciences,"Radiology, Drug Development, Medical Writing, Biotechnology, Healthcare Administration","Biotechnology, Medical Devices",Healthcare Services
54,Person 54,Engineering & Manufacturing,"Robotics, Supply Chain Management, Plant Operations","Mechanical Design, 3D CAD Modeling, Industrial Automation",Electrical Engineering
55,Person 55,Hospitality & Travel,"Restaurant Management, Cruise Management, Guest Relations, Travel Writing, Hospitality Marketing","Cultural Tourism, Hospitality Innovation, Hotel Management, Sustainable Tourism",Tourism
56,Person 56,Hospitality & Travel,"Travel Planning, Travel Coordination, Tour Operations, Bartending","Travel Planning, Adventure Travel, Hotel Management, Culinary Arts",Event Management
57,Person 57,Government & Non-Profit,"Public Relations, Grant Writing","International Relations, NGO Work",Non-Profit
58,Person 58,Technology & IT,"IoT, Full Stack Development","Automation, Big Data, Mobile App Development, Digital Transformation",Blockchain
59,Person 59,Hospitality & Travel,"Tourism Management, Bartending, Reservation Management, Customer Service, Recreation Management","Hospitality Innovation, Sustainable Tourism, Cultural Tourism, Cruise Tourism",Event Management
60,Person 60,Agriculture & Food Production,"Supply Chain Management in Agriculture, Post-Harvest Management, Sustainable Agriculture, Agroforestry","Irrigation Systems, Permaculture, AgriTech Innovation, Rural Development",Livestock Management
61,Person 61,Legal & Compliance,"Arbitration, Environmental Law, Corporate Governance, Regulatory Compliance","Intellectual Property, Corporate Law, Human Rights Law",Litigation
62,Person 62,Healthcare & Life Sciences,"Drug Development, Medical Writing","Public Health, Epidemiology, Health Informatics",Healthcare Services
63,Person 63,Hospitality & Travel,"Reservation Management, Tour Operations, Tourism Management, Travel Coordination","Hospitality Innovation, Culinary Arts",Recreation & Leisure
64,Person 64,Finance & Banking,"Valuation, Fraud Detection, Asset Management, Financial Reporting","Banking Technology, Risk Management",Financial Services
65,Person 65,Healthcare & Life Sciences,"Genomics, Medical Imaging","Patient Advocacy, Biotechnology, Telemedicine",Healthcare Services
66,Person 66,Transportation & Logistics,"Inventory Control, Third-Party Logistics (3PL), Cross-Docking","Transport Policy, Aviation Industry, Route Optimization, Freight Management",Trucking
67,Person 67,Consumer Goods & Retail,"Logistics, Vendor Management, Inventory Management, Retail Analytics, Sales Strategy","Brand Management, Digital Marketing",Consumer Electronics
68,Person 68,Agriculture & Food Production,"Agroforestry, Post-Harvest Management, Agricultural Research","Irrigation Systems, Organic Farming",Livestock Management
69,Person 69,Energy & Utilities,"Renewable Energy, Grid Management, Well Logging, Energy Efficiency","Water Resource Management, Renewable Energy, Climate Change Mitigation, Energy Conservation",Nuclear Energy
70,Person 70,Media & Entertainment,"Videography, Video Editing, Scriptwriting","Digital Media, Journalism, Podcasting, Music Production",Advertising
71,Person 71,Media & Entertainment,"3D Modeling, Animation, Content Strategy, Graphic Design, Scriptwriting","Music Production, Broadcasting",Music Industry
72,Person 72,Education & Training,"Career Counseling, Teaching","Lifelong Learning, Inclusive Education, Educational Research, E-learning",Language Learning
73,Person 73,Healthcare & Life Sciences,"Epidemiology, Radiology, Clinical Trials Management, Lab Technician, Healthcare Policy","Health & Wellness, Bioethics",Medical Devices
74,Person 74,Energy & Utilities,"Energy Efficiency, Smart Grid Technology, Geotechnical Engineering, Geophysics","Nuclear Energy, Energy Conservation",Nuclear Energy
75,Person 75,Legal & Compliance,"Anti-Money Laundering, Labor Law, Litigation Support, Intellectual Property Law, Fraud Prevention","Ethics, Legal Research, Consumer Protection, Employment Law",Labor Law
76,Person 76,Consumer Goods & Retail,"Category Management, Procurement, Retail Analytics","Retail Innovation, E-commerce",E-commerce
77,Person 77,Education & Training,"Blended Learning, Online Course Development, Student Advising, Vocational Training","Educational Technology, Lifelong Learning, Corporate Training",EdTech
78,Person 78,Real Estate & Construction,"Structural Engineering, Contract Negotiation, Property Valuation, Project Planning, Architecture","Landscaping, Real Estate Development, Residential Real Estate, Commercial Real Estate",Building Materials
79,Person 79,Media & Entertainment,"Post-Production, Event Planning, Brand Storytelling, Broadcasting","Animation, Music Production, Digital Media, Scriptwriting",Journalism
80,Person 80,Hospitality & Travel,"Travel Planning, Sustainable Tourism, Customer Service, Tourism Management","Cultural Tourism, Cruise Tourism, Adventure Travel, Travel Planning",Tourism
81,Person 81,Transportation & Logistics,"Logistics Engineering, Route Planning","Sustainable Transport, Supply Chain Management, Urban Transit",Urban Transit
82,Person 82,Healthcare & Life Sciences,"Telemedicine, Public Health, Epidemiology, Healthcare IT, Regulatory Affairs","Healthcare Innovation, Biotechnology, Health & Wellness, Health Informatics",Clinical Research
83,Person 83,Transportation & Logistics,"Cold Chain Logistics, Freight Forwarding, Logistics Coordination","Transport Policy, Freight Management, Automotive Engineering",Supply Chain Management
84,Person 84,Legal & Compliance,"Contract Law, Corporate Law","Mediation, Employment Law, Human Rights Law, Intellectual Property",Legal Services
85,Person 85,Transportation & Logistics,"Freight Forwarding, Route Planning, Inventory Control, Transportation Planning","Smart Cities, Aviation Industry, Automotive Engineering",Railway
86,Person 86,Healthcare & Life Sciences,"Healthcare Administration, Occupational Therapy, EHR Management","Holistic Health, Bioethics, Medical Devices, Nursing",Public Health
87,Person 87,Transportation & Logistics,"Inventory Control, Maritime Operations","Supply Chain Management, Freight Management, Automotive Engineering",Supply Chain Management
88,Person 88,Healthcare & Life Sciences,"Healthcare Administration, Patient Care","Health & Wellness, Mental Health Awareness, Genomics",Medical Imaging
89,Person 89,Government & Non-Profit,"Public Policy Analysis, Humanitarian Aid, Urban Planning, Social Work, Disaster Management","Community Development, Urban Planning",Public Policy
90,Person 90,Healthcare & Life Sciences,"Telemedicine, Bioinformatics, Genomics, Public Health","Public Health, Medical Research",Medical Devices
91,Person 91,Legal & Compliance,"Compliance Auditing, Risk Management, Patent Law","Environmental Law, Criminal Justice",Legal Services
92,Person 92,Energy & Utilities,"Nuclear Engineering, Energy Efficiency, Well Logging, Drilling Engineering","Climate Change Mitigation, Nuclear Energy",Environmental Engineering
93,Person 93,Transportation & Logistics,"Route Planning, Logistics Technology, Logistics Coordination, Supply Chain Optimization","Sustainable Transport, Route Optimization, Automotive Engineering, Railway Systems",Transportation Planning
94,Person 94,Healthcare & Life Sciences,"Medical Device Design, Biomedical Engineering, Drug Development, Public Health","Healthcare Policy, Clinical Trials",Medical Imaging
95,Person 95,Hospitality & Travel,"Catering, Travel Writing, Travel Planning","Sustainable Tourism, Culinary Arts",Hotels & Resorts
96,Person 96,Agriculture & Food Production,"Supply Chain Management in Agriculture, Organic Farming, Farm Management, Sustainable Agriculture, Agroforestry","Fisheries Management, Organic Farming, Sustainable Agriculture",Farming
97,Person 97,Energy & Utilities,"Smart Grid Technology, Oil & Gas Exploration","Waste Management, Green Technologies, Energy Policy, Energy Conservation",Electricity Generation
98,Person 98,Healthcare & Life Sciences,"Pharmacovigilance, Healthcare Administration, Health Informatics","Healthcare Policy, Medical Research",Clinical Research
99,Person 99,Hospitality & Travel,"Recreation Management, Reservation Management","Tourism, Travel Planning, Hotel Management, Hospitality Innovation",Food & Beverage Services
100,Person 100,Technology & IT,"Software Development, Networking","System Architecture, Hackathons, Software Development, Mobile App Development",Software Development
101,Person 101,Hospitality & Travel,"Reservation Management, Sustainable Tourism","Cultural Tourism, Culinary Arts, Sustainable Tourism, Adventure Travel",Tourism
102,Person 102,Legal & Compliance,"International Law, Litigation","Corporate Law, Data Privacy",Tax Law
103,Person 103,Healthcare & Life Sciences,"Radiology, Health Informatics, Pharmacovigilance","Public Health, Clinical Trials",Healthcare Services
104,Person 104,Technology & IT,"C++, Automation, Embedded Systems, Software Development","Blockchain, Data Science, Software Development, Digital Transformation",IoT
105,Person 105,Finance & Banking,"Credit Analysis, Investment Analysis","Banking Technology, Stock Market, Risk Management",Insurance
106,Person 106,Education & Training,"Academic Research, Curriculum Assessment","Language Learning, Curriculum Development",Curriculum Development
107,Person 107,Agriculture & Food Production,"Farm Management, Agricultural Research","Rural Development, Agribusiness, AgriTech Innovation, Food Safety",Forestry
108,Person 108,Healthcare & Life Sciences,"Nursing, Surgical Assistance","Genomics, Health Informatics",Public Health
109,Person 109,Education & Training,"Educational Technology, Online Course Development, Instructional Design, Education Policy, Blended Learning","Curriculum Development, Lifelong Learning, Student Mentorship",E-learning
110,Person 110,Technology & IT,"IT Consulting, Systems Administration, Front-end Development","Web Development, Big Data, Tech Blogging",Blockchain
111,Person 111,Healthcare & Life Sciences,"Public Health, Epidemiology, Pharmacovigilance","Health Informatics, Nutrition, Holistic Health",Public Health
112,Person 112,Agriculture & Food Production,"Agricultural Engineering, Pest Management, Agribusiness","Agroforestry, Permaculture, Organic Farming, Agribusiness",Forestry
113,Person 113,Hospitality & Travel,"Travel Coordination, Recreation Management, Restaurant Management","Event Management, Adventure Travel, Culinary Arts, Sustainable Tourism",Cruise Lines
114,Person 114,Real Estate & Construction,"Contract Negotiation, Residential Real Estate","Property Investment, Real Estate Development, Real Estate Law, Green Building",Interior Design
115,Person 115,Healthcare & Life Sciences,"Healthcare Policy, Healthcare Administration, Pharmaceutical Development, Biomedical Engineering","Holistic Health, Healthcare Innovation, Public Health",Nursing
116,Person 116,Government & Non-Profit,"Legal Compliance, Environmental Policy, Disaster Management","Urban Planning, International Relations, Environmental Conservation",NGO
117,Person 117,Transportation & Logistics,"Logistics Analysis, Transportation Management Systems (TMS), Maritime Operations, Import/Export Management, Warehouse Management","Route Optimization, Smart Cities",Trucking
118,Person 118,Agriculture & Food Production,"Supply Chain Management in Agriculture, Agroforestry, Agronomy","Crop Science, AgriTech Innovation",Farming
119,Person 119,Media & Entertainment,"Campaign Management, Photography, 3D Modeling","Graphic Design, Broadcasting, Performing Arts, Digital Media",Advertising
120,Person 120,Technology & IT,"Full Stack Development, Cloud Computing, Mobile App Development, Embedded Systems, Virtualization","Cybersecurity, 3D Printing",Web Development
121,Person 121,Education & Training,"Curriculum Assessment, Career Counseling, Teacher Training","EdTech Innovation, Inclusive Education, Educational Research",EdTech
122,Person 122,Consumer Goods & Retail,"Pricing Strategy, Customer Service, Market Research, Inventory Management, Brand Management","Fashion Trends, Customer Experience Design, Consumer Behavior, Sustainable Consumer Goods",Fashion
123,Person 123,Agriculture & Food Production,"Animal Husbandry, Post-Harvest Management, Plant Breeding, Livestock Management, Agronomy","Food Safety, Food Technology",Agriculture
124,Person 124,Real Estate & Construction,"Landscaping, Construction Scheduling, Sustainable Design, Construction Safety","Property Management, Construction Technology, Real Estate Development",Urban Planning
125,Person 125,Consumer Goods & Retail,"Sales Strategy, Pricing Strategy, Market Research","Luxury Goods, E-commerce, Supply Chain Optimization, Packaging Design",Logistics
126,Person 126,Real Estate & Construction,"Cost Estimation, Green Building, Landscaping, Residential Real Estate, Commercial Real Estate","Property Investment, Urban Development, Property Management, Interior Design",Construction Management
127,Person 127,Government & Non-Profit,"Public Administration, Disaster Management","Disaster Relief, Public Policy",Social Services
128,Person 128,Hospitality & Travel,"Customer Service, Resort Management","Hospitality Innovation, Event Management, Hotel Management",Food & Beverage Services
129,Person 129,Legal & Compliance,"Regulatory Compliance, Intellectual Property Law, Data Privacy, Legal Writing","Intellectual Property, Regulatory Compliance, Contract Negotiation, Human Rights Law",Intellectual Property Law
130,Person 130,Legal & Compliance,"Patent Law, Intellectual Property Law, Risk Management, Labor Law","Intellectual Property, Corporate Law",Corporate Law
131,Person 131,Hospitality & Travel,"Tourism Management, Bartending, Food & Beverage Management, Resort Management, Event Coordination","Hotel Management, Event Management",Airlines
132,Person 132,Healthcare & Life Sciences,"Biotechnology, EHR Management, Radiology","Bioethics, Medical Research, Mental Health Awareness",Public Health
133,Person 133,Transportation & Logistics,"Logistics Analysis, Shipping & Receiving, Logistics Coordination","Aviation Industry, Route Optimization, Maritime Logistics, Railway Systems",Aviation
134,Person 134,Energy & Utilities,"Grid Management, Bioenergy, Hydropower","Energy Auditing, Climate Change Mitigation, Energy Policy, Energy Conservation",Electricity Generation
135,Person 135,Technology & IT,"Software Development, Data Science, Virtualization","Internet of Things (IoT), Big Data, Virtual Reality, Machine Learning",Telecommunications
136,Person 136,Agriculture & Food Production,"Fisheries Management, Horticulture, Irrigation Systems, Organic Farming","Agroforestry, Food Safety, Agribusiness",Farming
137,Person 137,Finance & Banking,"Financial Analysis, Quantitative Analysis, Tax Planning, Risk Management, Credit Analysis","Tax Planning, Risk Management",Financial Services
138,Person 138,Hospitality & Travel,"Food & Beverage Management, Event Coordination","Cruise Tourism, Event Management, Culinary Arts",Airlines
139,Person 139,Finance & Banking,"Asset Management, Investment Analysis, Accounting, Insurance Underwriting, Tax Planning","Cryptocurrency, Corporate Finance",Real Estate Investment
140,Person 140,Education & Training,"Training Needs Analysis, Language Teaching","Educational Research, STEM Education, Corporate Training, Vocational Training",Language Learning
141,Person 141,Engineering & Manufacturing,"Robotics, Quality Control, Piping Design, Material Science","Manufacturing Processes, Robotics Engineering, Automotive Design, Civil Infrastructure",Automotive
142,Person 142,Legal & Compliance,"Anti-Money Laundering, Ethics & Compliance, Mediation","Environmental Law, Mediation, Corporate Law, Legal Research",Environmental Law
143,Person 143,Transportation & Logistics,"Logistics Analysis, Transportation Planning","Freight Management, Railway Systems, Route Optimization, Transport Policy",Maritime
144,Person 144,Consumer Goods & Retail,"Product Management, Product Sourcing, Market Research, Brand Management, Logistics","Product Development, Luxury Goods, Retail Innovation, Packaging Design",Logistics
145,Person 145,Healthcare & Life Sciences,"Healthcare Policy, Bioinformatics","Clinical Trials, Health & Wellness, Healthcare Policy",Biotechnology
146,Person 146,Media & Entertainment,"Animation, User Engagement, Influencer Marketing, Content Creation, Photography","Performing Arts, Scriptwriting, Podcasting, Music Production",Broadcasting
147,Person 147,Hospitality & Travel,"Catering, Culinary Arts, Bartending, Customer Service","Travel Planning, Hospitality Innovation, Adventure Travel",Recreation & Leisure
