profile_id,name,sector,skills,interests,current_industry
442,Person 442,Media & Entertainment,"Social Media Marketing, 3D Modeling, SEO, Sound Engineering","Cultural Events, Podcasting, Scriptwriting",Film & Television
443,Person 443,Consumer Goods & Retail,"Demand Planning, Brand Management, Category Management","Brand Management, Supply Chain Optimization, Sustainable Consumer Goods, Retail Innovation",Apparel & Footwear
444,Person 444,Education & Training,"Assessment Design, Online Course Development, Educational Technology, Learning Management Systems (LMS)","Educational Technology, Student Mentorship",Language Learning
445,Person 445,Legal & Compliance,"Legal Research, Litigation, Corporate Law","Consumer Protection, Employment Law, Human Rights Law",Legal Services
446,Person 446,Energy & Utilities,"Solar Energy, Power Generation, Energy Efficiency, Waste Management, Water Resource Management","Renewable Energy, Energy Conservation, Energy Auditing",Energy Trading
447,Person 447,Healthcare & Life Sciences,"Biotechnology, Drug Development, Patient Care","Telemedicine, Epidemiology",Healthcare Services
448,Person 448,Education & Training,"Educational Consulting, Curriculum Development","EdTech Innovation, Educational Research, Corporate Training",Tutoring Services
449,Person 449,Hospitality & Travel,"Sustainable Tourism, Recreation Management","Adventure Travel, Luxury Travel",Tourism
450,Person 450,Transportation & Logistics,"Logistics Engineering, Freight Forwarding, Third-Party Logistics (3PL), Transportation Management Systems (TMS), Warehouse Management","Aviation Industry, Maritime Logistics, Logistics Optimization",Trucking
451,Person 451,Government & Non-Profit,"Conflict Resolution, Advocacy, Research & Development","Civic Engagement, Public Administration, Social Justice, Urban Planning",Non-Profit
452,Person 452,Consumer Goods & Retail,"Demand Planning, Category Management, Market Research, Visual Merchandising","E-commerce, Brand Management, Sustainable Consumer Goods",Home Goods
453,Person 453,Hospitality & Travel,"Recreation Management, Travel Writing, Resort Management, Hospitality Management, Bartending","Sustainable Tourism, Travel Planning, Hotel Management",Travel Agencies
454,Person 454,Technology & IT,"Software Development, Project Management, Artificial Intelligence, Penetration Testing","Coding Challenges, Cybersecurity, Software Development, Tech Startups",AI Research
455,Person 455,Finance & Banking,"Mergers & Acquisitions, Treasury Management, Credit Analysis","Private Equity, Financial Literacy, Tax Planning, Portfolio Management",Financial Services
456,Person 456,Hospitality & Travel,"Cruise Management, Event Planning, Reservation Management","Recreation & Leisure, Tourism, Travel Planning",Casino & Gaming
457,Person 457,Real Estate & Construction,"Building Code Compliance, Site Management, Construction Scheduling, Urban Planning, Facility Management","Residential Real Estate, Commercial Real Estate, Landscaping",Residential Real Estate
458,Person 458,Consumer Goods & Retail,"Visual Merchandising, Retail Analytics, Customer Relationship Management, Logistics","Consumer Behavior, Packaging Design, Sustainable Consumer Goods, E-commerce",Logistics
459,Person 459,Education & Training,"Tutoring, Curriculum Assessment, Career Counseling, Curriculum Development, Special Education","Inclusive Education, Educational Research, Language Learning, Vocational Training",Higher Education
460,Person 460,Real Estate & Construction,"Commercial Real Estate, Building Information Modeling (BIM), Construction Safety, Structural Engineering","Property Investment, Urban Development, Sustainable Architecture",Building Materials
461,Person 461,Agriculture & Food Production,"Organic Farming, Livestock Management, Food Processing","Livestock Management, Sustainable Agriculture, Crop Science, Organic Farming",Organic Farming
462,Person 462,Engineering & Manufacturing,"Material Science, Civil Engineering, HVAC Engineering","Aerospace Technology, Product Design, Material Science",Chemical Engineering
463,Person 463,Healthcare & Life Sciences,"Epidemiology, Medical Writing, Nursing","Nursing, Environmental Health",Biotechnology
464,Person 464,Energy & Utilities,"Renewable Energy, Geophysics","Waste Management, Climate Change Mitigation",Mining
465,Person 465,Hospitality & Travel,"Sustainable Tourism, Hospitality Marketing, Hospitality Management, Resort Management, Cruise Management","Cultural Tourism, Recreation & Leisure",Cruise Lines
466,Person 466,Engineering & Manufacturing,"Six Sigma, 3D Printing, Product Design","Product Design, Sustainable Engineering, Renewable Energy",Process Engineering
467,Person 467,Government & Non-Profit,"Urban Planning, Research & Development, Humanitarian Aid, Environmental Policy, Policy Implementation","Non-Profit Management, Urban Planning, NGO Work, Environmental Conservation",International Development
468,Person 468,Government & Non-Profit,"Environmental Policy, Disaster Management, Public Administration","Public Policy, Non-Profit Management",Urban Planning
469,Person 469,Energy & Utilities,"Water Resource Management, Waste Management","Smart Grids, Renewable Energy",Oil & Gas
470,Person 470,Agriculture & Food Production,"Fisheries Management, Agricultural Research, Agricultural Engineering, Rural Development, AgriTech","Livestock Management, Food Technology, Permaculture, Food Safety",Livestock Management
471,Person 471,Media & Entertainment,"Content Strategy, Content Creation, Event Planning, Broadcasting","Cultural Events, Photography",Advertising
472,Person 472,Government & Non-Profit,"Public Policy Analysis, Non-Profit Management, Program Management, Environmental Policy","Civic Engagement, Non-Profit Management",NGO
473,Person 473,Media & Entertainment,"Digital Media Production, Scriptwriting, User Engagement","Music Production, Videography, Creative Writing, Social Media Content",Music Industry
474,Person 474,Real Estate & Construction,"Interior Design, Green Building","Real Estate Development, Landscaping, Sustainable Architecture, Commercial Real Estate",Building Materials
475,Person 475,Consumer Goods & Retail,"Retail Management, Retail Analytics, Logistics, Product Sourcing","Fashion Trends, Customer Experience Design",E-commerce
476,Person 476,Finance & Banking,"Asset Management, Auditing, Compliance, Treasury Management, Financial Modeling","Financial Planning, Real Estate Investment",Wealth Management
477,Person 477,Education & Training,"Educational Consulting, Assessment Design, Academic Research","Educational Policy, Lifelong Learning, Curriculum Development, Vocational Training",Educational Technology
478,Person 478,Government & Non-Profit,"Legislative Affairs, Non-Profit Management","Non-Profit Management, Urban Planning, Public Administration",Social Services
479,Person 479,Media & Entertainment,"Scriptwriting, Media Planning, Public Relations, Graphic Design","Public Relations, Film & Cinema",Film & Television
480,Person 480,Media & Entertainment,"Video Editing, Broadcasting, Scriptwriting","Animation, Social Media Content, Journalism",Content Creation
481,Person 481,Legal & Compliance,"Litigation Support, Fraud Prevention, Ethics & Compliance, Litigation","Corporate Law, Human Rights Law, Consumer Protection",Intellectual Property Law
482,Person 482,Media & Entertainment,"Content Creation, Influencer Marketing, Photography","Podcasting, Scriptwriting, Digital Media",Social Media Management
483,Person 483,Real Estate & Construction,"Sustainable Design, Commercial Real Estate, Property Management, Construction Scheduling","Urban Development, Commercial Real Estate, Residential Real Estate, Property Investment",Architecture
484,Person 484,Technology & IT,"Automation, DevOps","Cloud Computing, Hackathons",Machine Learning
485,Person 485,Agriculture & Food Production,"Crop Management, Soil Science","Sustainable Agriculture, Fisheries Management, AgriTech Innovation, Rural Development",Forestry
486,Person 486,Real Estate & Construction,"Cost Estimation, Property Management, Sustainable Design","Real Estate Law, Green Building",Construction Management
487,Person 487,Engineering & Manufacturing,"Automation Engineering, Quality Control, Supply Chain Management","Robotics Engineering, Electrical Systems, Lean Manufacturing",Electrical Engineering
488,Person 488,Engineering & Manufacturing,"Thermodynamics, Lean Manufacturing, Product Design, Automation Engineering","Manufacturing Processes, Nanotechnology, Material Science, Automotive Design",Manufacturing
489,Person 489,Energy & Utilities,"Petroleum Engineering, Energy Efficiency, Grid Management","Energy Conservation, Environmental Sustainability, Renewable Energy, Waste Management",Waste Management
490,Person 490,Technology & IT,"User Interface Design, Incident Response","3D Printing, Mobile App Development, System Architecture, Cybersecurity",Embedded Systems
491,Person 491,Education & Training,"Education Policy, Curriculum Development","Curriculum Development, Corporate Training, EdTech Innovation, Inclusive Education",E-learning
492,Person 492,Government & Non-Profit,"Non-Profit Management, Research & Development, Public Policy Analysis, Legislative Affairs","Social Justice, Disaster Relief, Environmental Conservation",Public Administration
493,Person 493,Legal & Compliance,"Regulatory Compliance, Patent Law, Legal Writing","Regulatory Compliance, Human Rights Law",Legal Services
494,Person 494,Engineering & Manufacturing,"Civil Engineering, Circuit Design, Quality Control, Structural Analysis","Industrial Automation, Material Science",Product Design
495,Person 495,Finance & Banking,"Tax Planning, Risk Management, Financial Planning","Financial Literacy, Stock Market, Financial Planning",Investment Banking
496,Person 496,Energy & Utilities,"Petroleum Engineering, Energy Trading, Drilling Engineering","Environmental Sustainability, Climate Change Mitigation, Smart Grids",Water Management
497,Person 497,Real Estate & Construction,"Structural Engineering, Cost Estimation, Facility Management, Urban Planning, Property Management","Urban Development, Property Investment, Green Building, Residential Real Estate",Urban Planning
498,Person 498,Transportation & Logistics,"Customs Brokerage, Cold Chain Logistics, Third-Party Logistics (3PL), Freight Forwarding","Smart Cities, Cold Chain Logistics, Transport Policy",Warehousing
499,Person 499,Technology & IT,"Front-end Development, Embedded Systems","System Architecture, 3D Printing, Tech Blogging, Augmented Reality",Embedded Systems
500,Person 500,Finance & Banking,"Credit Analysis, Financial Regulations, Underwriting, Tax Planning, Wealth Management","Risk Management, Personal Finance",Investment Banking
501,Person 501,Finance & Banking,"Treasury Management, Tax Planning","Real Estate Investment, Tax Planning, Economic Trends",Investment Banking
502,Person 502,Legal & Compliance,"Patent Law, Corporate Law","Corporate Law, Arbitration, Mediation, Data Privacy",Litigation
503,Person 503,Healthcare & Life Sciences,"Regulatory Affairs, Pharmaceutical Development, Clinical Trials Management, Medical Writing","Nutrition, Clinical Trials, Public Health",Healthcare IT
504,Person 504,Legal & Compliance,"Patent Law, Fraud Prevention","Arbitration, Corporate Law, Regulatory Compliance",Litigation
505,Person 505,Hospitality & Travel,"Reservation Management, Recreation Management, Hotel Operations","Hotel Management, Cruise Tourism",Hotels & Resorts
506,Person 506,Education & Training,"Curriculum Assessment, Instructional Design, Tutoring","Inclusive Education, EdTech Innovation",E-learning
507,Person 507,Transportation & Logistics,"Cross-Docking, Inventory Control","Railway Systems, Sustainable Transport, Logistics Optimization, Freight Management",Freight Forwarding
508,Person 508,Energy & Utilities,"Grid Management, Waste Management, Energy Auditing, Geotechnical Engineering","Environmental Sustainability, Nuclear Energy",Water Management
509,Person 509,Legal & Compliance,"Data Privacy, Intellectual Property Law, Anti-Money Laundering, Employment Law, Corporate Law","Mediation, Legal Research",Tax Law
510,Person 510,Healthcare & Life Sciences,"Patient Care, Healthcare Administration, Epidemiology, Nutritional Counseling","Health & Wellness, Public Health",Medical Imaging
511,Person 511,Education & Training,"Vocational Training, Learning Management Systems (LMS), Educational Technology, Online Course Development","Corporate Training, E-learning",Vocational Training
512,Person 512,Energy & Utilities,"Water Resource Management, Reservoir Engineering","Sustainable Development, Climate Change Mitigation, Green Technologies, Nuclear Energy",Nuclear Energy
513,Person 513,Agriculture & Food Production,"Agroforestry, Crop Management, Agronomy, Food Safety, Organic Farming","AgriTech Innovation, Fisheries Management, Crop Science, Urban Farming",Food Processing
514,Person 514,Technology & IT,"User Interface Design, Incident Response","Game Development, Robotics",Network Engineering
515,Person 515,Government & Non-Profit,"Policy Implementation, Volunteer Management, Legal Compliance, Community Development","Public Policy, Disaster Relief, Human Rights Advocacy, Civic Engagement",NGO
516,Person 516,Consumer Goods & Retail,"Customer Relationship Management, Merchandising, Vendor Management, Customer Service","Luxury Goods, Digital Marketing, Retail Innovation, Consumer Behavior",Fashion
517,Person 517,Hospitality & Travel,"Event Planning, Recreation Management, Customer Service, Destination Management, Resort Management","Event Management, Travel Writing, Cultural Tourism, Luxury Travel",Casino & Gaming
518,Person 518,Agriculture & Food Production,"Organic Farming, Crop Management, Dairy Farming","Permaculture, Sustainable Agriculture",Dairy Farming
519,Person 519,Legal & Compliance,"Anti-Money Laundering, Data Privacy, Intellectual Property Law, International Law, Labor Law","Data Privacy, Mediation",Litigation
520,Person 520,Energy & Utilities,"Petroleum Engineering, Waste Management, Hydropower, Energy Auditing, Mining Engineering","Environmental Sustainability, Waste Management, Smart Grids, Climate Change Mitigation",Water Management
521,Person 521,Media & Entertainment,"Journalism, Media Planning","Creative Writing, Public Relations, Graphic Design, Animation",Social Media Management
522,Person 522,Finance & Banking,"Accounting, Tax Planning, Risk Management, Credit Analysis","Sustainable Investing, Economic Trends, Risk Management",Insurance
523,Person 523,Agriculture & Food Production,"Animal Husbandry, Dairy Farming, Agricultural Research, Plant Breeding, Agribusiness","Food Safety, Rural Development, Sustainable Agriculture",Forestry
524,Person 524,Healthcare & Life Sciences,"Drug Development, Healthcare Policy, Pharmaceutical Development, Health Informatics","Telemedicine, Nutrition, Biotechnology, Medical Devices",Nursing
525,Person 525,Education & Training,"Blended Learning, Learning Management Systems (LMS)","Curriculum Development, Vocational Training, Inclusive Education",Corporate Training
526,Person 526,Government & Non-Profit,"Government Relations, Disaster Management","Public Administration, International Relations, Social Justice, Civic Engagement",Public Administration
527,Person 527,Energy & Utilities,"Drilling Engineering, Nuclear Engineering, Renewable Energy","Sustainable Development, Waste Management, Smart Grids",Renewable Energy
528,Person 528,Legal & Compliance,"Employment Law, Legal Writing","Intellectual Property, Arbitration, Consumer Protection",Legal Services
529,Person 529,Hospitality & Travel,"Airline Management, Culinary Arts, Resort Management, Hospitality Marketing","Adventure Travel, Luxury Travel, Tourism",Cruise Lines
530,Person 530,Healthcare & Life Sciences,"Healthcare Data Analysis, Medical Device Design, Bioinformatics, Surgical Assistance","Holistic Health, Epidemiology, Nursing, Medical Devices",Nursing
531,Person 531,Agriculture & Food Production,"Agronomy, Agroforestry, Animal Husbandry","Crop Science, Agroforestry, Livestock Management",Forestry
532,Person 532,Energy & Utilities,"Hydropower, Pipeline Engineering, Environmental Compliance, Energy Auditing, Nuclear Engineering","Energy Policy, Environmental Sustainability, Waste Management",Electricity Generation
533,Person 533,Agriculture & Food Production,"Organic Farming, Plant Breeding","Rural Development, Agribusiness, Irrigation Systems, Crop Science",Food Processing
534,Person 534,Technology & IT,"Agile Methodologies, Software Testing","Cloud Computing, Mobile App Development, Open Source Projects",Automation
535,Person 535,Engineering & Manufacturing,"Process Engineering, Piping Design, Civil Engineering","Civil Infrastructure, Aerospace Technology, Material Science, Electrical Systems",Automotive
536,Person 536,Technology & IT,"C++, Front-end Development, Artificial Intelligence, User Interface Design","Automation, Data Science, Machine Learning",AI Research
537,Person 537,Transportation & Logistics,"Logistics Analysis, Import/Export Management, Cold Chain Logistics","Automotive Engineering, Maritime Logistics",Aviation
538,Person 538,Media & Entertainment,"Campaign Management, 3D Modeling, Broadcasting, User Engagement","Podcasting, Journalism, Public Relations",Film & Television
539,Person 539,Finance & Banking,"Equity Research, Financial Planning, Wealth Management, Budgeting","Economic Trends, Private Equity, Wealth Management, Cryptocurrency",Real Estate Investment
540,Person 540,Engineering & Manufacturing,"Piping Design, Circuit Design, Product Development","Nanotechnology, Civil Infrastructure",Mechanical Engineering
541,Person 541,Engineering & Manufacturing,"Mechanical Engineering, Thermodynamics, CAD Design","Automotive Design, Renewable Energy",Electrical Engineering
542,Person 542,Real Estate & Construction,"Site Management, Sustainable Design","Real Estate Development, Urban Development, Landscaping",Commercial Real Estate
543,Person 543,Government & Non-Profit,"Fundraising, Government Relations, Community Development, Public Speaking, Research & Development","Non-Profit Management, Community Development, Public Policy, Urban Planning",International Development
544,Person 544,Hospitality & Travel,"Travel Writing, Hospitality Management, Customer Service","Travel Writing, Luxury Travel",Tourism
545,Person 545,Media & Entertainment,"SEO, Advertising, Social Media Marketing, Content Creation","Music Production, Public Relations, Broadcasting, Performing Arts",Digital Media
546,Person 546,Engineering & Manufacturing,"Six Sigma, Supply Chain Management, Construction Management, Industrial Design","Civil Infrastructure, Material Science",Product Design
547,Person 547,Consumer Goods & Retail,"Visual Merchandising, Procurement, Supply Chain Optimization, Demand Planning","Brand Management, Sustainable Consumer Goods, Product Development",Logistics
548,Person 548,Legal & Compliance,"Litigation Support, International Law, Arbitration, Compliance Auditing, Employment Law","Legal Research, Regulatory Compliance, Corporate Law",Corporate Law
549,Person 549,Real Estate & Construction,"Site Management, Construction Scheduling, Structural Engineering, Contract Negotiation, Commercial Real Estate","Urban Development, Interior Design, Green Building, Real Estate Law",Commercial Real Estate
550,Person 550,Real Estate & Construction,"Construction Safety, Green Building, Real Estate Development, Property Valuation, Real Estate Investment","Property Management, Property Investment, Construction Technology",Interior Design
551,Person 551,Healthcare & Life Sciences,"Occupational Therapy, Epidemiology, Patient Care, Biomedical Engineering","Bioethics, Nursing, Public Health, Medical Research",Healthcare Services
552,Person 552,Hospitality & Travel,"Catering, Travel Planning, Event Coordination","Recreation & Leisure, Cultural Tourism, Travel Writing",Food & Beverage Services
553,Person 553,Healthcare & Life Sciences,"Healthcare Administration, Patient Care, Clinical Trials Management","Pharmaceuticals, Medical Devices",Healthcare IT
554,Person 554,Government & Non-Profit,"Program Management, Environmental Policy, Social Justice, Fundraising, International Development","NGO Work, Civic Engagement, Human Rights Advocacy, Community Development",Urban Planning
555,Person 555,Education & Training,"Educational Consulting, Academic Research","Student Mentorship, Language Learning",Educational Technology
556,Person 556,Media & Entertainment,"Animation, Social Media Marketing, Videography","Animation, Social Media Content, Videography, Broadcasting",Broadcasting
557,Person 557,Real Estate & Construction,"Site Management, Property Valuation, Zoning & Land Use, Interior Design","Interior Design, Residential Real Estate, Landscaping",Real Estate Development
558,Person 558,Legal & Compliance,"Regulatory Compliance, Ethics & Compliance","Human Rights Law, Contract Negotiation, Arbitration",Regulatory Affairs
559,Person 559,Media & Entertainment,"Graphic Design, Influencer Marketing, Content Creation, Content Strategy","Public Relations, Film & Cinema",Publishing
560,Person 560,Energy & Utilities,"Smart Grid Technology, Solar Energy, Environmental Compliance, Bioenergy","Green Technologies, Environmental Sustainability",Mining
561,Person 561,Education & Training,"Special Education, Educational Technology","Educational Technology, Educational Research, Student Mentorship",Corporate Training
562,Person 562,Media & Entertainment,"Sound Engineering, SEO, Broadcasting, Animation","Creative Writing, Scriptwriting",Social Media Management
563,Person 563,Real Estate & Construction,"Building Information Modeling (BIM), Construction Safety, Construction Management, Green Building","Property Management, Interior Design",Real Estate Development
564,Person 564,Finance & Banking,"Compliance, Financial Reporting, Credit Analysis, Mergers & Acquisitions, Budgeting","FinTech Innovation, Financial Literacy, Real Estate Investment",Insurance
565,Person 565,Education & Training,"Education Policy, Teaching, E-learning Development, Academic Research, Vocational Training","Curriculum Development, Educational Research, EdTech Innovation",Higher Education
566,Person 566,Energy & Utilities,"Geophysics, Power Generation","Renewable Energy, Energy Policy, Nuclear Energy",Energy Trading
567,Person 567,Transportation & Logistics,"Inventory Control, Supply Chain Optimization, Demand Planning, Import/Export Management, Cross-Docking","Urban Transit, Sustainable Transport",Railway
568,Person 568,Finance & Banking,"Mergers & Acquisitions, Underwriting, Investment Analysis","Wealth Management, FinTech Innovation, Economic Trends, Investment Strategies",Investment Banking
569,Person 569,Education & Training,"Student Advising, Curriculum Development","Educational Policy, Language Learning",EdTech
570,Person 570,Engineering & Manufacturing,"Product Development, Production Planning, Piping Design, Structural Analysis, Lean Manufacturing","Manufacturing Processes, Renewable Energy, Aerospace Technology",Civil Engineering
571,Person 571,Engineering & Manufacturing,"HVAC Engineering, Six Sigma, Process Engineering, Thermodynamics, Lean Manufacturing","Robotics Engineering, Automotive Design",Quality Control
572,Person 572,Legal & Compliance,"Corporate Law, Compliance Auditing","Mediation, Regulatory Compliance, Environmental Law",Litigation
573,Person 573,Engineering & Manufacturing,"Thermodynamics, Supply Chain Management, Product Development, Circuit Design, Plant Operations","Nanotechnology, Industrial Automation, Sustainable Engineering, Civil Infrastructure",Aerospace
574,Person 574,Engineering & Manufacturing,"CAD Design, Quality Control, Plant Operations, Project Scheduling","Robotics Engineering, Civil Infrastructure, Industrial Automation, Automotive Design",Product Design
575,Person 575,Agriculture & Food Production,"Food Safety, Irrigation Systems, Plant Breeding, AgriTech","Organic Farming, Sustainable Agriculture, Agroforestry, Agribusiness",Forestry
576,Person 576,Real Estate & Construction,"Interior Design, Building Information Modeling (BIM), Construction Safety","Real Estate Development, Construction Technology",Construction Management
577,Person 577,Legal & Compliance,"Anti-Money Laundering, Litigation, Employment Law","Human Rights Law, Regulatory Compliance",Legal Services
578,Person 578,Technology & IT,"HTML, Penetration Testing, Networking, User Interface Design, Database Management","Mobile App Development, Blockchain, Internet of Things (IoT), Augmented Reality",Network Engineering
579,Person 579,Real Estate & Construction,"Contract Negotiation, Residential Real Estate","Property Management, Sustainable Architecture, Interior Design, Urban Development",Landscaping
580,Person 580,Media & Entertainment,"Social Media Marketing, Brand Storytelling, Media Planning","Graphic Design, Performing Arts, Film & Cinema",Digital Media
581,Person 581,Technology & IT,"Tech Support, C++, Big Data, UX Design, Penetration Testing","Augmented Reality, 3D Printing, Big Data, Tech Blogging",IoT
582,Person 582,Hospitality & Travel,"Sustainable Tourism, Event Coordination, Hotel Operations, Recreation Management","Luxury Travel, Travel Writing",Tourism
583,Person 583,Hospitality & Travel,"Destination Management, Tour Operations","Travel Writing, Tourism, Sustainable Tourism",Hospitality Management
584,Person 584,Energy & Utilities,"Hydropower, Petroleum Engineering, Smart Grid Technology","Renewable Energy, Nuclear Energy, Climate Change Mitigation, Energy Auditing",Nuclear Energy
585,Person 585,Hospitality & Travel,"Tourism Management, Hotel Operations, Reservation Management, Food & Beverage Management","Recreation & Leisure, Adventure Travel, Event Management, Luxury Travel",Hospitality Management
