profile_id,name,sector,skills,interests,current_industry
876,Person 876,Real Estate & Construction,"Residential Real Estate, Architecture, Interior Design, Structural Engineering, Construction Scheduling","Sustainable Architecture, Construction Technology",Building Materials
877,Person 877,Consumer Goods & Retail,"Customer Relationship Management, Customer Service, Procurement","Product Development, E-commerce, Sustainable Consumer Goods, Retail Analytics",Supply Chain Management
878,Person 878,Healthcare & Life Sciences,"Bioinformatics, Medical Writing, Nursing","Healthcare Policy, Environmental Health",Pharmaceuticals
879,Person 879,Government & Non-Profit,"Public Policy Analysis, Humanitarian Aid, Volunteer Management, Non-Profit Management, Research & Development","Public Administration, Social Justice, Disaster Relief",Community Development
880,Person 880,Legal & Compliance,"Litigation Support, Data Privacy, Arbitration, Intellectual Property Law","Criminal Justice, Mediation",Litigation
881,Person 881,Finance & Banking,"Accounting, Corporate Finance, Financial Modeling","Stock Market, Investment Strategies, Risk Management",FinTech
882,Person 882,Healthcare & Life Sciences,"Healthcare Marketing, Medical Writing, Bioinformatics","Mental Health Awareness, Public Health, Bioethics, Health & Wellness",Healthcare IT
883,Person 883,Agriculture & Food Production,"Food Processing, Agribusiness, Supply Chain Management in Agriculture, Organic Farming, Sustainable Agriculture","Fisheries Management, AgriTech Innovation",Dairy Farming
884,Person 884,Finance & Banking,"Insurance Underwriting, Tax Planning, Financial Reporting, Corporate Finance, Portfolio Management","Cryptocurrency, Financial Planning, Venture Capital, Corporate Finance",Wealth Management
885,Person 885,Agriculture & Food Production,"Food Processing, AgriTech","AgriTech Innovation, Food Safety, Crop Science",Livestock Management
886,Person 886,Legal & Compliance,"Corporate Law, Intellectual Property Law, Arbitration","Ethics, Data Privacy, Corporate Law, Arbitration",Legal Services
887,Person 887,Transportation & Logistics,"Logistics Engineering, Cross-Docking, Rail Transport","Automotive Engineering, Supply Chain Management, Smart Cities",Transportation Planning
888,Person 888,Media & Entertainment,"Graphic Design, Videography","Animation, Podcasting, Music Production",Film & Television
889,Person 889,Media & Entertainment,"Graphic Design, User Engagement, Photography","Scriptwriting, Graphic Design, Cultural Events",Content Creation
890,Person 890,Education & Training,"Career Counseling, Education Policy, Language Teaching","Student Mentorship, Inclusive Education",Corporate Training
891,Person 891,Finance & Banking,"FinTech, Valuation, Wealth Management","Tax Planning, Banking Technology",Venture Capital
892,Person 892,Consumer Goods & Retail,"Customer Service, Retail Management, Product Sourcing","Product Development, Retail Innovation, Retail Analytics, Fashion Trends",Apparel & Footwear
893,Person 893,Healthcare & Life Sciences,"Epidemiology, Medical Imaging, Radiology, Telemedicine, Drug Development","Genomics, Epidemiology, Nursing",Healthcare IT
894,Person 894,Consumer Goods & Retail,"Supply Chain Optimization, Demand Planning, Merchandising","Packaging Design, Retail Analytics, Product Development, Consumer Behavior",Food & Beverage
895,Person 895,Consumer Goods & Retail,"Customer Service, Consumer Behavior Analysis, Retail Management, Supply Chain Logistics, Brand Management","Fashion Trends, E-commerce, Digital Marketing",Supply Chain Management
896,Person 896,Finance & Banking,"FinTech, Investment Analysis, Credit Analysis, Financial Modeling","Stock Market, Corporate Finance, Wealth Management, Risk Management",Investment Banking
897,Person 897,Hospitality & Travel,"Food & Beverage Management, Recreation Management, Bartending, Cruise Management, Travel Coordination","Hotel Management, Tourism, Cultural Tourism, Travel Planning",Tourism
898,Person 898,Engineering & Manufacturing,"Material Science, Thermodynamics, Product Development, Quality Control, Electrical Engineering","Material Science, Nanotechnology, Automotive Design",Automotive
899,Person 899,Government & Non-Profit,"Disaster Management, Non-Profit Management","Public Policy, Public Administration, Urban Planning",NGO
900,Person 900,Agriculture & Food Production,"Post-Harvest Management, Supply Chain Management in Agriculture, Livestock Management, Soil Science","Sustainable Agriculture, Livestock Management",Fisheries
901,Person 901,Energy & Utilities,"Energy Efficiency, Petroleum Engineering, Wind Energy, Water Resource Management, Drilling Engineering","Nuclear Energy, Energy Policy, Green Technologies, Environmental Sustainability",Electricity Generation
902,Person 902,Agriculture & Food Production,"Rural Development, Fisheries Management, AgriTech, Animal Husbandry, Supply Chain Management in Agriculture","AgriTech Innovation, Agribusiness",Dairy Farming
903,Person 903,Healthcare & Life Sciences,"EHR Management, Health Informatics","Public Health, Healthcare Policy",Healthcare Services
904,Person 904,Media & Entertainment,"Graphic Design, Influencer Marketing, Digital Media Production","Film & Cinema, Videography",Film & Television
905,Person 905,Agriculture & Food Production,"Agricultural Engineering, Livestock Management, Rural Development","Organic Farming, AgriTech Innovation",AgriTech
906,Person 906,Transportation & Logistics,"Urban Transit Planning, Maritime Operations, Rail Transport, Demand Planning, Logistics Technology","Urban Transit, Transport Policy, Supply Chain Management",Trucking
907,Person 907,Energy & Utilities,"Waste Management, Grid Management, Environmental Compliance, Nuclear Engineering","Climate Change Mitigation, Oil & Gas Exploration, Waste Management, Green Technologies",Nuclear Energy
908,Person 908,Technology & IT,"Java, Software Development, JavaScript, Cloud Computing, Full Stack Development","System Architecture, Artificial Intelligence, Tech Startups, Robotics",Software Development
909,Person 909,Finance & Banking,"Financial Reporting, Asset Management, Wealth Management, Financial Planning","Stock Market, Tax Planning",Financial Services
910,Person 910,Energy & Utilities,"Solar Energy, Water Resource Management","Environmental Sustainability, Sustainable Development",Mining
911,Person 911,Healthcare & Life Sciences,"Public Health, Nutritional Counseling, Biotechnology","Clinical Trials, Nutrition, Bioethics",Pharmaceuticals
912,Person 912,Education & Training,"Learning Management Systems (LMS), Curriculum Development","Educational Policy, Inclusive Education, Curriculum Development",Vocational Training
913,Person 913,Education & Training,"Learning Management Systems (LMS), Blended Learning, E-learning Development, Tutoring, Teacher Training","Curriculum Development, E-learning, Language Learning",E-learning
914,Person 914,Consumer Goods & Retail,"Consumer Behavior Analysis, Category Management, Procurement","Retail Analytics, Product Development, E-commerce",Retail
915,Person 915,Legal & Compliance,"Legal Research, Patent Law, International Law","Contract Negotiation, Mediation, Consumer Protection",Corporate Law
916,Person 916,Education & Training,"Tutoring, Assessment Design, Classroom Management, Academic Research, Curriculum Development","Student Mentorship, Language Learning, Educational Policy, Educational Technology",Vocational Training
917,Person 917,Agriculture & Food Production,"Irrigation Systems, Farm Management, Crop Management","Irrigation Systems, Agribusiness",Food Processing
918,Person 918,Healthcare & Life Sciences,"Healthcare Administration, Genomics","Clinical Trials, Biotechnology",Clinical Research
919,Person 919,Legal & Compliance,"Ethics & Compliance, Corporate Governance","Legal Research, Environmental Law, Arbitration",Legal Services
920,Person 920,Engineering & Manufacturing,"Six Sigma, Robotics, Control Systems, Quality Control, Process Engineering","Mechanical Design, Sustainable Engineering",Product Design
921,Person 921,Hospitality & Travel,"Restaurant Management, Travel Writing, Travel Planning, Customer Service, Catering","Cultural Tourism, Travel Writing, Culinary Arts, Recreation & Leisure",Travel Agencies
922,Person 922,Government & Non-Profit,"Legal Compliance, Fundraising, Advocacy, Disaster Management","Public Policy, NGO Work, Disaster Relief, Civic Engagement",Social Services
923,Person 923,Energy & Utilities,"Environmental Engineering, Sustainability, Oil & Gas Exploration, Power Generation","Oil & Gas Exploration, Energy Policy, Smart Grids",Water Management
924,Person 924,Consumer Goods & Retail,"Visual Merchandising, Supply Chain Logistics, Demand Planning, Product Sourcing, Category Management","Digital Marketing, Customer Experience Design",Home Goods
925,Person 925,Media & Entertainment,"Animation, Post-Production, Content Creation","Creative Writing, Social Media Content, Digital Media, Broadcasting",Digital Media
926,Person 926,Healthcare & Life Sciences,"Healthcare Data Analysis, Healthcare IT","Pharmaceuticals, Mental Health Awareness, Health & Wellness, Healthcare Policy",Healthcare Services
927,Person 927,Finance & Banking,"Auditing, Equity Research, Risk Management, Financial Modeling, Financial Reporting","Wealth Management, FinTech Innovation",Venture Capital
928,Person 928,Energy & Utilities,"Renewable Energy, Pipeline Engineering, Environmental Compliance","Climate Change Mitigation, Energy Conservation, Energy Auditing, Energy Policy",Water Management
929,Person 929,Media & Entertainment,"Event Planning, Public Relations","Music Production, Journalism, Social Media Content",Music Industry
930,Person 930,Technology & IT,"Database Management, Systems Administration, Blockchain","Cloud Computing, Automation",Web Development
931,Person 931,Transportation & Logistics,"Maritime Operations, Transportation Planning, Rail Transport","Logistics Optimization, Smart Cities, Aviation Industry, Railway Systems",Freight Forwarding
932,Person 932,Energy & Utilities,"Reservoir Engineering, Energy Efficiency, Energy Trading, Renewable Energy","Water Resource Management, Climate Change Mitigation, Energy Conservation, Smart Grids",Waste Management
933,Person 933,Finance & Banking,"Treasury Management, Financial Analysis, Accounting","Tax Planning, Corporate Finance, Cryptocurrency, Risk Management",Wealth Management
934,Person 934,Transportation & Logistics,"Route Planning, Supply Chain Management, Logistics Analysis","Sustainable Transport, Cold Chain Logistics, Maritime Logistics, Automotive Engineering",Aviation
935,Person 935,Government & Non-Profit,"Environmental Policy, Government Relations, Research & Development, Community Development","Urban Planning, Human Rights Advocacy",Public Policy
936,Person 936,Consumer Goods & Retail,"Supply Chain Logistics, Supply Chain Optimization, E-commerce Management, Category Management, Customer Relationship Management","Retail Innovation, Sustainable Consumer Goods, Supply Chain Optimization, Consumer Behavior",Fashion
937,Person 937,Government & Non-Profit,"Public Relations, Non-Profit Management, Advocacy, Public Speaking, Grant Writing","Community Development, Public Policy",NGO
938,Person 938,Engineering & Manufacturing,"Robotics, Quality Control, Piping Design, Plant Operations","3D CAD Modeling, Quality Control",Mechanical Engineering
939,Person 939,Transportation & Logistics,"Aviation Operations, Logistics Engineering, Warehouse Management, Logistics Analysis, Shipping & Receiving","Logistics Optimization, Urban Transit, Supply Chain Management, Maritime Logistics",Transportation Planning
940,Person 940,Agriculture & Food Production,"Dairy Farming, Rural Development, Agribusiness","Permaculture, AgriTech Innovation, Food Safety, Agribusiness",Livestock Management
941,Person 941,Legal & Compliance,"Corporate Governance, Employment Law, Tax Law","Criminal Justice, Intellectual Property, Employment Law, Mediation",Intellectual Property Law
942,Person 942,Media & Entertainment,"Event Planning, Post-Production","Scriptwriting, Photography",Broadcasting
943,Person 943,Technology & IT,"Python, HTML","Artificial Intelligence, Machine Learning, Big Data, Open Source Projects",IT Consulting
944,Person 944,Engineering & Manufacturing,"Circuit Design, Material Science, Product Design, Industrial Design, Six Sigma","Industrial Automation, 3D CAD Modeling, Mechanical Design, Automotive Design",Civil Engineering
945,Person 945,Media & Entertainment,"Scriptwriting, Sound Engineering, Content Creation, Campaign Management","Scriptwriting, Public Relations, Photography, Social Media Content",Content Creation
946,Person 946,Energy & Utilities,"Hydropower, Environmental Engineering","Energy Conservation, Smart Grids, Climate Change Mitigation, Oil & Gas Exploration",Utilities
947,Person 947,Media & Entertainment,"Post-Production, 3D Modeling, Photography, SEO","Public Relations, Broadcasting",Film & Television
948,Person 948,Healthcare & Life Sciences,"Medical Imaging, EHR Management, Healthcare Administration, Clinical Research","Telemedicine, Health Informatics",Pharmaceuticals
949,Person 949,Real Estate & Construction,"Real Estate Investment, Surveying, Urban Planning, Sustainable Design, Construction Scheduling","Real Estate Law, Property Management, Residential Real Estate",Residential Real Estate
950,Person 950,Legal & Compliance,"Litigation Support, Patent Law, Compliance Auditing","Arbitration, Regulatory Compliance, Legal Research, Mediation",Intellectual Property Law
951,Person 951,Technology & IT,"Python, Artificial Intelligence, Data Science","Mobile App Development, Web Development",Machine Learning
952,Person 952,Hospitality & Travel,"Bartending, Travel Writing, Hotel Operations, Destination Management, Culinary Arts","Recreation & Leisure, Cultural Tourism, Tourism, Adventure Travel",Food & Beverage Services
953,Person 953,Agriculture & Food Production,"Agroforestry, Irrigation Systems, Horticulture","Sustainable Agriculture, Permaculture, AgriTech Innovation",Organic Farming
954,Person 954,Consumer Goods & Retail,"Product Management, Pricing Strategy, Inventory Management, Demand Planning","Consumer Behavior, Sustainable Consumer Goods, Fashion Trends, Product Development",Supply Chain Management
955,Person 955,Agriculture & Food Production,"Agricultural Engineering, Sustainable Agriculture, Rural Development, Food Safety","Rural Development, Permaculture",Fisheries
956,Person 956,Healthcare & Life Sciences,"Telemedicine, Health Informatics, Lab Technician, Medical Writing","Nutrition, Holistic Health",Healthcare IT
957,Person 957,Legal & Compliance,"Anti-Money Laundering, Contract Law, Employment Law, Environmental Law","Human Rights Law, Corporate Law, Arbitration",Corporate Law
958,Person 958,Hospitality & Travel,"Destination Management, Bartending","Sustainable Tourism, Travel Planning, Recreation & Leisure",Casino & Gaming
959,Person 959,Government & Non-Profit,"Urban Planning, Public Policy Analysis, Social Justice, Volunteer Management","International Relations, Community Development, Disaster Relief",Community Development
960,Person 960,Engineering & Manufacturing,"Product Design, Lean Manufacturing","Electrical Systems, Lean Manufacturing, Robotics Engineering",Process Engineering
961,Person 961,Education & Training,"Student Advising, Career Counseling, Teacher Training","Curriculum Development, Lifelong Learning",Corporate Training
962,Person 962,Transportation & Logistics,"Maritime Operations, Fleet Management, Shipping & Receiving, Import/Export Management, Cross-Docking","Logistics Optimization, Supply Chain Management",Shipping
963,Person 963,Hospitality & Travel,"Reservation Management, Customer Service, Bartending, Resort Management, Event Planning","Hotel Management, Recreation & Leisure, Sustainable Tourism",Hospitality Management
964,Person 964,Agriculture & Food Production,"Soil Science, Rural Development, Farm Management, Agribusiness, Livestock Management","Organic Farming, Rural Development, Permaculture",Dairy Farming
965,Person 965,Finance & Banking,"Credit Analysis, Mergers & Acquisitions","Personal Finance, Corporate Finance, Venture Capital, Tax Planning",FinTech
966,Person 966,Hospitality & Travel,"Customer Service, Catering","Culinary Arts, Luxury Travel, Travel Writing, Travel Planning",Cruise Lines
967,Person 967,Real Estate & Construction,"Interior Design, Facility Management, Urban Planning, Landscaping","Landscaping, Real Estate Law, Sustainable Architecture",Landscaping
968,Person 968,Agriculture & Food Production,"AgriTech, Plant Breeding, Fisheries Management","Agroforestry, Livestock Management",Livestock Management
969,Person 969,Finance & Banking,"Accounting, Tax Planning, Risk Management, Corporate Finance","Tax Planning, Risk Management",FinTech
970,Person 970,Engineering & Manufacturing,"CAD Design, Thermodynamics, Construction Management","Manufacturing Processes, Quality Control",Civil Engineering
971,Person 971,Technology & IT,"Incident Response, Agile Methodologies, UI Design, Java","Blockchain, Robotics",Embedded Systems
972,Person 972,Real Estate & Construction,"Residential Real Estate, Real Estate Investment, Building Code Compliance, Property Management, Construction Management","Green Building, Property Investment",Architecture
973,Person 973,Technology & IT,"UX Design, Mobile App Development","Blockchain, Augmented Reality, Cybersecurity, Data Science",IT Consulting
974,Person 974,Healthcare & Life Sciences,"Pharmaceutical Development, EHR Management, Nursing, Epidemiology","Genomics, Biotechnology, Holistic Health",Medical Devices
975,Person 975,Transportation & Logistics,"Warehouse Management, Shipping & Receiving, Maritime Operations","Aviation Industry, Sustainable Transport, Cold Chain Logistics, Automotive Engineering",Trucking
976,Person 976,Real Estate & Construction,"Sustainable Design, Property Valuation, Urban Planning","Sustainable Architecture, Green Building",Architecture
977,Person 977,Consumer Goods & Retail,"Inventory Management, Logistics, Market Research, Brand Management","Sustainable Consumer Goods, E-commerce",Logistics
978,Person 978,Healthcare & Life Sciences,"Nutritional Counseling, Patient Care","Environmental Health, Healthcare Policy",Telemedicine
979,Person 979,Transportation & Logistics,"Import/Export Management, Third-Party Logistics (3PL), Cold Chain Logistics, Route Planning, Aviation Operations","Cold Chain Logistics, Urban Transit",Trucking
980,Person 980,Finance & Banking,"Valuation, Wealth Management, Treasury Management","Financial Literacy, Cryptocurrency, Stock Market, Corporate Finance",Private Equity
981,Person 981,Real Estate & Construction,"Facility Management, Project Planning, Structural Engineering, Construction Scheduling","Real Estate Law, Interior Design, Residential Real Estate, Commercial Real Estate",Real Estate Development
982,Person 982,Education & Training,"Career Counseling, Blended Learning, Online Course Development, Vocational Training","Corporate Training, Curriculum Development, Educational Policy",K-12 Education
983,Person 983,Government & Non-Profit,"Public Speaking, Community Development","Urban Planning, Government Affairs",Social Services
984,Person 984,Finance & Banking,"Compliance, Fraud Detection, Quantitative Analysis, Accounting, Budgeting","Banking Technology, Tax Planning, Financial Planning",Private Equity
985,Person 985,Media & Entertainment,"Digital Media Production, SEO, Media Planning, Graphic Design, 3D Modeling","Animation, Graphic Design, Social Media Content",Social Media Management
986,Person 986,Media & Entertainment,"Animation, Post-Production, Content Creation, Video Editing, Sound Engineering","Public Relations, Videography",Journalism
987,Person 987,Transportation & Logistics,"Import/Export Management, Shipping & Receiving, Logistics Technology, Transportation Management Systems (TMS)","Cold Chain Logistics, Smart Cities, Logistics Optimization",Shipping
988,Person 988,Hospitality & Travel,"Reservation Management, Tour Operations, Culinary Arts","Adventure Travel, Travel Writing, Recreation & Leisure",Recreation & Leisure
989,Person 989,Government & Non-Profit,"Environmental Policy, Volunteer Management, Social Work, Social Justice, Legislative Affairs","NGO Work, Government Affairs, International Relations, Public Policy",Government
990,Person 990,Technology & IT,"Data Analysis, User Interface Design, C++","Tech Startups, Robotics",Network Engineering
991,Person 991,Agriculture & Food Production,"Agricultural Engineering, Agroforestry, Livestock Management, Food Safety","Fisheries Management, Agroforestry",Dairy Farming
992,Person 992,Legal & Compliance,"Contract Law, Patent Law, Legal Writing, Employment Law, Compliance Auditing","Ethics, Consumer Protection, Regulatory Compliance, Mediation",Environmental Law
993,Person 993,Energy & Utilities,"Mining Engineering, Geotechnical Engineering","Climate Change Mitigation, Environmental Sustainability, Water Resource Management, Smart Grids",Energy Trading
994,Person 994,Legal & Compliance,"Data Privacy, Contract Law, International Law","Regulatory Compliance, Human Rights Law, Intellectual Property, Data Privacy",Tax Law
995,Person 995,Legal & Compliance,"Corporate Governance, Litigation Support, Risk Management","Corporate Law, Legal Research, Intellectual Property",Labor Law
996,Person 996,Consumer Goods & Retail,"Inventory Management, Product Sourcing, Sales Strategy, Logistics","E-commerce, Retail Analytics",Apparel & Footwear
997,Person 997,Technology & IT,"Front-end Development, Embedded Systems, Big Data","Data Science, Augmented Reality",Video Game Development
998,Person 998,Finance & Banking,"Wealth Management, Corporate Finance, Portfolio Management, Mergers & Acquisitions, Tax Planning","Corporate Finance, Venture Capital, Banking Technology",Investment Banking
999,Person 999,Consumer Goods & Retail,"Market Research, E-commerce Management, Retail Analytics, Pricing Strategy","Retail Analytics, Digital Marketing, Luxury Goods",Food & Beverage
1000,Person 1000,Hospitality & Travel,"Tour Operations, Catering, Restaurant Management, Event Coordination, Cruise Management","Hospitality Innovation, Recreation & Leisure",Airlines
1001,Person 1001,Media & Entertainment,"Sound Engineering, Post-Production, Advertising","Animation, Performing Arts",Public Relations
1002,Person 1002,Government & Non-Profit,"Social Work, Advocacy, Public Speaking, Public Relations, Public Policy Analysis","Civic Engagement, Government Affairs, Public Policy",Non-Profit
1003,Person 1003,Finance & Banking,"Financial Modeling, FinTech","Banking Technology, Risk Management, Stock Market, Portfolio Management",Private Equity
1004,Person 1004,Education & Training,"Special Education, Instructional Design, Student Advising","E-learning, Educational Technology, Student Mentorship",Language Learning
1005,Person 1005,Healthcare & Life Sciences,"Health Informatics, Nutritional Counseling, Nursing","Healthcare Policy, Nursing, Clinical Trials",Biotechnology
1006,Person 1006,Transportation & Logistics,"Logistics Engineering, Import/Export Management, Customs Brokerage","Logistics Optimization, Cold Chain Logistics",Freight Forwarding
1007,Person 1007,Real Estate & Construction,"Sustainable Design, Building Code Compliance, Construction Safety, Real Estate Investment, Facility Management","Residential Real Estate, Interior Design",Building Materials
1008,Person 1008,Legal & Compliance,"Anti-Money Laundering, Legal Research, Regulatory Compliance","Data Privacy, Criminal Justice, Mediation",Labor Law
1009,Person 1009,Engineering & Manufacturing,"Lean Manufacturing, Structural Analysis, 3D Printing, Project Scheduling, Circuit Design","Industrial Automation, Renewable Energy, Civil Infrastructure",Product Design
1010,Person 1010,Energy & Utilities,"Well Logging, Bioenergy, Grid Management","Sustainable Development, Water Resource Management, Smart Grids, Oil & Gas Exploration",Oil & Gas
1011,Person 1011,Legal & Compliance,"Corporate Governance, Legal Writing, Mediation, Employment Law, Regulatory Compliance","Regulatory Compliance, Contract Negotiation",Labor Law
1012,Person 1012,Real Estate & Construction,"Project Planning, Property Valuation, Real Estate Development","Real Estate Development, Urban Development, Landscaping, Real Estate Law",Residential Real Estate
1013,Person 1013,Healthcare & Life Sciences,"Medical Device Design, Nutritional Counseling","Healthcare Policy, Genomics, Biotechnology",Healthcare IT
1014,Person 1014,Finance & Banking,"Financial Reporting, Asset Management, Treasury Management","Banking Technology, Corporate Finance, Financial Planning",Real Estate Investment
1015,Person 1015,Agriculture & Food Production,"AgriTech, Rural Development, Food Processing","Urban Farming, Crop Science, Agribusiness, Food Technology",Livestock Management
1016,Person 1016,Education & Training,"E-learning Development, Special Education","Educational Research, Student Mentorship",Language Learning
1017,Person 1017,Finance & Banking,"Financial Reporting, Auditing, Portfolio Management","Personal Finance, Tax Planning, Sustainable Investing",Corporate Finance
1018,Person 1018,Education & Training,"Career Counseling, Curriculum Development","Educational Research, E-learning",Vocational Training
1019,Person 1019,Hospitality & Travel,"Hospitality Management, Travel Coordination, Resort Management, Hotel Operations","Cruise Tourism, Tourism, Hospitality Innovation, Recreation & Leisure",Travel Agencies
1020,Person 1020,Healthcare & Life Sciences,"Pharmaceutical Development, Bioinformatics, Healthcare Administration, Genomics","Telemedicine, Genomics, Biotechnology",Biotechnology
1021,Person 1021,Consumer Goods & Retail,"Vendor Management, Market Research, Category Management, Brand Management, Supply Chain Logistics","Brand Management, E-commerce",Food & Beverage
