profile_id,name,sector,skills,interests,current_industry
1449,Person 1449,Finance & Banking,"Valuation, Asset Management","Venture Capital, Stock Market",Wealth Management
1450,Person 1450,Real Estate & Construction,"Structural Engineering, Construction Scheduling, Contract Negotiation","Urban Development, Sustainable Architecture, Green Building",Residential Real Estate
1451,Person 1451,Government & Non-Profit,"Disaster Management, Program Management","Public Policy, Disaster Relief, Environmental Conservation",Non-Profit
1452,Person 1452,Consumer Goods & Retail,"Pricing Strategy, Procurement","Packaging Design, Digital Marketing, Supply Chain Optimization, Fashion Trends",Fashion
1453,Person 1453,Agriculture & Food Production,"Agronomy, Agribusiness, Agroforestry","Organic Farming, Livestock Management, Food Safety",Fisheries
1454,Person 1454,Finance & Banking,"Valuation, Auditing, Accounting","Real Estate Investment, Risk Management, Financial Literacy, Venture Capital",Real Estate Investment
1455,Person 1455,Technology & IT,"Artificial Intelligence, Project Management","Machine Learning, Blockchain",Tech
1456,Person 1456,Finance & Banking,"Compliance, Financial Regulations, Investment Analysis, Auditing, Mergers & Acquisitions","Investment Strategies, Economic Trends, Cryptocurrency, Financial Planning",FinTech
1457,Person 1457,Education & Training,"Learning Management Systems (LMS), Instructional Design, Blended Learning, Curriculum Assessment, Educational Consulting","Language Learning, Educational Policy, Vocational Training",Language Learning
1458,Person 1458,Transportation & Logistics,"Aviation Operations, Transportation Management Systems (TMS), Freight Forwarding","Smart Cities, Transport Policy",Maritime
1459,Person 1459,Technology & IT,"Front-end Development, Cloud Computing, Software Development","Cybersecurity, Software Development, Hackathons, Coding Challenges",Cloud Computing
1460,Person 1460,Hospitality & Travel,"Catering, Guest Relations, Travel Coordination","Hotel Management, Travel Writing, Adventure Travel",Casino & Gaming
1461,Person 1461,Legal & Compliance,"Litigation, Regulatory Compliance, Mediation, Legal Writing, Employment Law","Environmental Law, Corporate Law, Legal Research, Regulatory Compliance",Legal Services
1462,Person 1462,Agriculture & Food Production,"Agribusiness, AgriTech, Farm Management, Agricultural Research","Sustainable Agriculture, Fisheries Management, Organic Farming",Farming
1463,Person 1463,Legal & Compliance,"Anti-Money Laundering, Tax Law, Litigation, Contract Law, Mediation","Employment Law, Data Privacy, Legal Research",Legal Services
1464,Person 1464,Transportation & Logistics,"Rail Transport, Urban Transit Planning, Logistics Coordination, Logistics Analysis","Freight Management, Sustainable Transport, Urban Transit, Aviation Industry",Urban Transit
1465,Person 1465,Real Estate & Construction,"Sustainable Design, Contract Negotiation, Building Code Compliance, Architecture, Property Management","Interior Design, Green Building, Property Investment",Landscaping
1466,Person 1466,Government & Non-Profit,"Public Policy Analysis, Advocacy, Volunteer Management","Civic Engagement, Non-Profit Management",Non-Profit
1467,Person 1467,Legal & Compliance,"Legal Research, Corporate Governance","Ethics, Intellectual Property, Environmental Law, Legal Research",Environmental Law
1468,Person 1468,Technology & IT,"Back-end Development, Systems Administration","Open Source Projects, Robotics, System Architecture, Internet of Things (IoT)",Video Game Development
1469,Person 1469,Transportation & Logistics,"Logistics Analysis, Maritime Operations, Fleet Management","Maritime Logistics, Freight Management, Automotive Engineering",Freight Forwarding
1470,Person 1470,Education & Training,"Educational Technology, Classroom Management, Blended Learning","Student Mentorship, Curriculum Development, Educational Policy, E-learning",EdTech
1471,Person 1471,Energy & Utilities,"Energy Efficiency, Renewable Energy, Smart Grid Technology, Geotechnical Engineering","Sustainable Development, Smart Grids, Energy Policy, Nuclear Energy",Electricity Generation
1472,Person 1472,Consumer Goods & Retail,"Customer Relationship Management, Demand Planning, Supply Chain Logistics","Retail Analytics, Customer Experience Design, Supply Chain Optimization, Consumer Behavior",Retail
1473,Person 1473,Agriculture & Food Production,"Pest Management, Dairy Farming, Soil Science","Food Safety, AgriTech Innovation",Livestock Management
1474,Person 1474,Finance & Banking,"Asset Management, Corporate Finance, Forecasting, Investment Analysis, Valuation","Wealth Management, FinTech Innovation, Financial Literacy, Real Estate Investment",FinTech
1475,Person 1475,Hospitality & Travel,"Event Planning, Hotel Operations","Travel Planning, Cruise Tourism, Cultural Tourism, Event Management",Cruise Lines
1476,Person 1476,Hospitality & Travel,"Culinary Arts, Hotel Operations","Culinary Arts, Luxury Travel, Tourism, Recreation & Leisure",Cruise Lines
1477,Person 1477,Education & Training,"Learning Management Systems (LMS), Classroom Management, Tutoring","Educational Policy, Educational Technology, Corporate Training",Tutoring Services
1478,Person 1478,Media & Entertainment,"Social Media Marketing, Sound Engineering, Digital Media Production","Public Relations, Creative Writing, Scriptwriting, Podcasting",Social Media Management
1479,Person 1479,Engineering & Manufacturing,"Robotics, Product Design, CAD Design, Manufacturing Engineering","Industrial Automation, 3D CAD Modeling, Electrical Systems",Quality Control
1480,Person 1480,Government & Non-Profit,"Conflict Resolution, Social Work, Disaster Management, Environmental Policy","Social Justice, Non-Profit Management, NGO Work, Public Policy",Advocacy
1481,Person 1481,Energy & Utilities,"Renewable Energy, Solar Energy","Energy Auditing, Smart Grids, Nuclear Energy",Energy Trading
1482,Person 1482,Media & Entertainment,"Content Creation, Graphic Design, Event Planning, Post-Production","Animation, Digital Media",Film & Television
1483,Person 1483,Hospitality & Travel,"Airline Management, Reservation Management","Tourism, Adventure Travel, Cultural Tourism",Event Management
1484,Person 1484,Hospitality & Travel,"Sustainable Tourism, Customer Service, Catering, Hospitality Management, Tour Operations","Cruise Tourism, Tourism",Hospitality Management
1485,Person 1485,Media & Entertainment,"Campaign Management, Digital Media Production, Post-Production, SEO","Public Relations, Social Media Content, Scriptwriting",Music Industry
1486,Person 1486,Energy & Utilities,"Bioenergy, Waste Management, Petroleum Engineering","Smart Grids, Green Technologies, Sustainable Development, Oil & Gas Exploration",Energy Trading
1487,Person 1487,Agriculture & Food Production,"Supply Chain Management in Agriculture, Pest Management","Sustainable Agriculture, Urban Farming, Organic Farming",Food Processing
1488,Person 1488,Technology & IT,"IoT, Systems Administration, Java, Front-end Development, Back-end Development","Game Development, Cloud Computing, Mobile App Development, Open Source Projects",Tech
1489,Person 1489,Hospitality & Travel,"Travel Coordination, Tour Operations","Cultural Tourism, Recreation & Leisure",Recreation & Leisure
1490,Person 1490,Agriculture & Food Production,"AgriTech, Food Processing, Pest Management, Plant Breeding","Permaculture, Urban Farming, Food Technology",Farming
1491,Person 1491,Agriculture & Food Production,"Pest Management, Post-Harvest Management, Agribusiness","Urban Farming, Livestock Management, Fisheries Management, Food Technology",Organic Farming
1492,Person 1492,Finance & Banking,"Risk Management, Valuation, Forecasting, Financial Planning","Venture Capital, Private Equity",Corporate Finance
1493,Person 1493,Legal & Compliance,"Litigation, International Law, Legal Research, Corporate Governance","Ethics, Mediation, Intellectual Property, Legal Research",Labor Law
1494,Person 1494,Agriculture & Food Production,"AgriTech, Food Processing, Agribusiness, Animal Husbandry","Organic Farming, Crop Science, Sustainable Agriculture, Livestock Management",Food Processing
1495,Person 1495,Legal & Compliance,"Legal Consulting, Legal Research, Contract Law, Environmental Law, Corporate Law","Regulatory Compliance, Intellectual Property",Legal Services
1496,Person 1496,Education & Training,"Teaching, Instructional Design","STEM Education, Educational Research, Educational Technology, Corporate Training",Educational Technology
1497,Person 1497,Education & Training,"E-learning Development, Educational Consulting, Teacher Training, Special Education","Educational Policy, E-learning, Language Learning, Student Mentorship",Corporate Training
1498,Person 1498,Transportation & Logistics,"Logistics Coordination, Logistics Engineering","Sustainable Transport, Smart Cities",Shipping
1499,Person 1499,Engineering & Manufacturing,"Electrical Engineering, Civil Engineering, Automation Engineering, Structural Analysis","Quality Control, Material Science, Sustainable Engineering, Renewable Energy",Aerospace
1500,Person 1500,Engineering & Manufacturing,"HVAC Engineering, Material Science, Mechanical Engineering","Electrical Systems, Material Science, Sustainable Engineering",Civil Engineering
1501,Person 1501,Finance & Banking,"Asset Management, Budgeting","Tax Planning, Financial Planning, Portfolio Management, Personal Finance",Financial Services
1502,Person 1502,Engineering & Manufacturing,"Supply Chain Management, Piping Design, CAD Design, Electrical Engineering","Civil Infrastructure, 3D CAD Modeling, Lean Manufacturing, Product Design",Manufacturing
1503,Person 1503,Technology & IT,"Networking, Full Stack Development, Front-end Development, Cybersecurity, Java","Robotics, Digital Transformation, Cloud Computing, Tech Blogging",Tech
1504,Person 1504,Consumer Goods & Retail,"Supply Chain Logistics, E-commerce Management, Market Research","Product Development, Retail Innovation",Retail
1505,Person 1505,Hospitality & Travel,"Cruise Management, Destination Management, Hospitality Management","Event Management, Sustainable Tourism",Tourism
1506,Person 1506,Transportation & Logistics,"Transportation Planning, Demand Planning, Transportation Management Systems (TMS)","Railway Systems, Automotive Engineering, Cold Chain Logistics, Freight Management",Maritime
1507,Person 1507,Legal & Compliance,"Mediation, Fraud Prevention, Compliance Auditing","Consumer Protection, Arbitration, Legal Research",Environmental Law
1508,Person 1508,Finance & Banking,"Wealth Management, Quantitative Analysis, Treasury Management, Financial Reporting","Investment Strategies, Banking Technology, Sustainable Investing, Venture Capital",Venture Capital
1509,Person 1509,Healthcare & Life Sciences,"EHR Management, Patient Care, Occupational Therapy, Surgical Assistance, Medical Writing","Healthcare Innovation, Healthcare Policy",Biotechnology
1510,Person 1510,Technology & IT,"UX Design, DevOps","Digital Transformation, Robotics",Telecommunications
1511,Person 1511,Transportation & Logistics,"Rail Transport, Third-Party Logistics (3PL), Import/Export Management, Freight Forwarding","Railway Systems, Route Optimization, Freight Management",Warehousing
1512,Person 1512,Agriculture & Food Production,"AgriTech, Supply Chain Management in Agriculture, Dairy Farming","AgriTech Innovation, Agroforestry, Agribusiness",Agriculture
1513,Person 1513,Education & Training,"Training Needs Analysis, Blended Learning, Vocational Training","Curriculum Development, Educational Technology",E-learning
1514,Person 1514,Energy & Utilities,"Smart Grid Technology, Power Generation, Drilling Engineering","Oil & Gas Exploration, Environmental Sustainability",Nuclear Energy
1515,Person 1515,Consumer Goods & Retail,"Vendor Management, Product Sourcing, Digital Marketing, Retail Management","Retail Innovation, Supply Chain Optimization, Customer Experience Design, E-commerce",Logistics
1516,Person 1516,Media & Entertainment,"Social Media Marketing, Campaign Management, Digital Media Production, Sound Engineering","Music Production, Animation",Film & Television
1517,Person 1517,Consumer Goods & Retail,"Demand Planning, Customer Service, Product Sourcing","Packaging Design, Consumer Behavior, Customer Experience Design, Brand Management",Logistics
1518,Person 1518,Finance & Banking,"Budgeting, Corporate Finance, Credit Analysis, Forecasting","Sustainable Investing, Risk Management, Investment Strategies",Financial Services
1519,Person 1519,Technology & IT,"DevOps, Data Science, Web Development, Network Security","Automation, Software Development, 3D Printing, Internet of Things (IoT)",Software Development
1520,Person 1520,Consumer Goods & Retail,"Brand Management, Market Research, Merchandising, Retail Analytics, Supply Chain Logistics","Customer Experience Design, Product Development, Retail Innovation, Fashion Trends",Apparel & Footwear
1521,Person 1521,Legal & Compliance,"Regulatory Compliance, Risk Management","Environmental Law, Regulatory Compliance",Regulatory Affairs
1522,Person 1522,Education & Training,"Tutoring, Education Policy, Learning Management Systems (LMS), Vocational Training","Educational Policy, Corporate Training, EdTech Innovation",Curriculum Development
1523,Person 1523,Consumer Goods & Retail,"Sales Strategy, Customer Service, Consumer Behavior Analysis","Packaging Design, Retail Innovation",Logistics
1524,Person 1524,Technology & IT,"Blockchain, Automation, Big Data, Data Science","Machine Learning, Tech Blogging, 3D Printing, Open Source Projects",Cybersecurity
1525,Person 1525,Agriculture & Food Production,"Rural Development, Agricultural Engineering","Organic Farming, Rural Development, Crop Science",Livestock Management
1526,Person 1526,Media & Entertainment,"Brand Storytelling, Sound Engineering, Public Relations, Social Media Marketing, Broadcasting","Journalism, Digital Media",Content Creation
1527,Person 1527,Engineering & Manufacturing,"Industrial Design, Lean Manufacturing, Mechanical Engineering, CAD Design","Renewable Energy, Aerospace Technology, Lean Manufacturing",Aerospace
1528,Person 1528,Transportation & Logistics,"Logistics Engineering, Customs Brokerage, Transportation Planning, Cold Chain Logistics","Supply Chain Management, Cold Chain Logistics, Smart Cities",Trucking
1529,Person 1529,Technology & IT,"Network Security, Mobile App Development, Data Analysis, Virtualization, UI Design","Data Science, Tech Startups, Augmented Reality",Telecommunications
1530,Person 1530,Finance & Banking,"Asset Management, Financial Modeling","Portfolio Management, Investment Strategies",Venture Capital
1531,Person 1531,Engineering & Manufacturing,"Robotics, Control Systems, Mechanical Engineering","Product Design, 3D CAD Modeling",Civil Engineering
1532,Person 1532,Engineering & Manufacturing,"Product Design, 3D Printing, Lean Manufacturing, Mechanical Engineering","Nanotechnology, Civil Infrastructure",Automotive
1533,Person 1533,Consumer Goods & Retail,"Retail Analytics, Supply Chain Optimization","Packaging Design, Brand Management",Apparel & Footwear
1534,Person 1534,Transportation & Logistics,"Logistics Analysis, Urban Transit Planning, Third-Party Logistics (3PL), Import/Export Management, Demand Planning","Aviation Industry, Freight Management, Route Optimization, Maritime Logistics",Maritime
1535,Person 1535,Transportation & Logistics,"Logistics Analysis, Customs Brokerage, Urban Transit Planning","Urban Transit, Freight Management",Maritime
1536,Person 1536,Transportation & Logistics,"Rail Transport, Fleet Management, Maritime Operations, Logistics Engineering","Route Optimization, Supply Chain Management, Smart Cities",Freight Forwarding
1537,Person 1537,Healthcare & Life Sciences,"Public Health, Health Informatics, Clinical Trials Management, Radiology","Bioethics, Nutrition",Medical Devices
1538,Person 1538,Agriculture & Food Production,"Food Safety, Organic Farming, Agribusiness, Pest Management, Sustainable Agriculture","Livestock Management, Irrigation Systems",Forestry
1539,Person 1539,Hospitality & Travel,"Reservation Management, Travel Writing, Culinary Arts","Recreation & Leisure, Hotel Management, Travel Writing",Event Management
1540,Person 1540,Consumer Goods & Retail,"Visual Merchandising, Product Sourcing, Retail Analytics","Digital Marketing, E-commerce, Sustainable Consumer Goods",E-commerce
1541,Person 1541,Agriculture & Food Production,"Fisheries Management, Horticulture, Agroforestry, Soil Science","Rural Development, Urban Farming, Irrigation Systems, Food Technology",Organic Farming
1542,Person 1542,Transportation & Logistics,"Fleet Management, Cross-Docking","Aviation Industry, Transport Policy, Maritime Logistics, Cold Chain Logistics",Aviation
1543,Person 1543,Finance & Banking,"FinTech, Mergers & Acquisitions, Auditing","Sustainable Investing, Cryptocurrency",Investment Banking
1544,Person 1544,Agriculture & Food Production,"Rural Development, Animal Husbandry, Agroforestry, Agronomy, Dairy Farming","Fisheries Management, Livestock Management",Crop Science
1545,Person 1545,Finance & Banking,"Investment Analysis, Financial Regulations, Forecasting, FinTech","FinTech Innovation, Venture Capital, Risk Management",FinTech
1546,Person 1546,Finance & Banking,"Asset Management, Budgeting, Equity Research, Compliance","Sustainable Investing, Economic Trends, Wealth Management, Cryptocurrency",FinTech
1547,Person 1547,Legal & Compliance,"Legal Writing, Risk Management, Mediation, Litigation","Data Privacy, Ethics, Intellectual Property, Environmental Law",Corporate Law
1548,Person 1548,Media & Entertainment,"Campaign Management, Animation, Videography, User Engagement, Brand Storytelling","Animation, Creative Writing, Social Media Content, Public Relations",Social Media Management
1549,Person 1549,Media & Entertainment,"SEO, 3D Modeling","Podcasting, Graphic Design, Cultural Events",Social Media Management
1550,Person 1550,Finance & Banking,"Wealth Management, Financial Analysis","Wealth Management, Venture Capital, Tax Planning, Financial Literacy",Real Estate Investment
1551,Person 1551,Healthcare & Life Sciences,"Surgical Assistance, Nutritional Counseling","Health Informatics, Pharmaceuticals, Telemedicine",Clinical Research
1552,Person 1552,Legal & Compliance,"Corporate Law, Patent Law, Fraud Prevention, Legal Writing","Criminal Justice, Employment Law, Regulatory Compliance, Legal Research",Labor Law
1553,Person 1553,Finance & Banking,"Auditing, Asset Management, Investment Analysis","Venture Capital, Financial Literacy",Financial Services
1554,Person 1554,Consumer Goods & Retail,"Inventory Management, Retail Management","Product Development, Sustainable Consumer Goods",Logistics
1555,Person 1555,Legal & Compliance,"Mediation, Risk Management, Employment Law, Environmental Law","Consumer Protection, Legal Research, Contract Negotiation",Litigation
1556,Person 1556,Media & Entertainment,"Advertising, Brand Storytelling","Broadcasting, Videography",Digital Media
1557,Person 1557,Engineering & Manufacturing,"Construction Management, Production Planning","Robotics Engineering, Material Science, Civil Infrastructure",Aerospace
1558,Person 1558,Finance & Banking,"Portfolio Management, Underwriting","Economic Trends, Private Equity, Investment Strategies",Real Estate Investment
1559,Person 1559,Real Estate & Construction,"Construction Scheduling, Interior Design, Site Management","Interior Design, Residential Real Estate",Property Management
1560,Person 1560,Hospitality & Travel,"Travel Coordination, Destination Management, Tourism Management, Catering, Hotel Operations","Event Management, Hotel Management, Adventure Travel, Cultural Tourism",Hospitality Management
1561,Person 1561,Agriculture & Food Production,"Irrigation Systems, Supply Chain Management in Agriculture","Organic Farming, Food Technology",Livestock Management
1562,Person 1562,Technology & IT,"IT Consulting, Big Data","Augmented Reality, Open Source Projects, Tech Startups",Web Development
1563,Person 1563,Technology & IT,"Web Development, Automation, Agile Methodologies, Back-end Development","Robotics, Web Development, Cybersecurity",Robotics
1564,Person 1564,Energy & Utilities,"Reservoir Engineering, Hydropower, Smart Grid Technology","Nuclear Energy, Waste Management, Climate Change Mitigation, Sustainable Development",Nuclear Energy
1565,Person 1565,Engineering & Manufacturing,"HVAC Engineering, Quality Control, Piping Design","Nanotechnology, Product Design",Product Design
1566,Person 1566,Engineering & Manufacturing,"CAD Design, Construction Management, Material Science","Nanotechnology, Civil Infrastructure",Manufacturing
1567,Person 1567,Government & Non-Profit,"Urban Planning, Conflict Resolution, Public Relations, Community Development, Fundraising","NGO Work, Public Policy, Civic Engagement",International Development
1568,Person 1568,Education & Training,"Tutoring, Blended Learning, Corporate Training, Online Course Development, Vocational Training","Vocational Training, Inclusive Education, Educational Research",EdTech
1569,Person 1569,Healthcare & Life Sciences,"Clinical Research, Pharmaceutical Development, Epidemiology","Medical Devices, Telemedicine, Pharmaceuticals, Medical Research",Medical Devices
1570,Person 1570,Legal & Compliance,"Mediation, Tax Law","Criminal Justice, Human Rights Law, Intellectual Property, Legal Research",Legal Services
1571,Person 1571,Government & Non-Profit,"Urban Planning, Policy Implementation, Government Relations","Non-Profit Management, Human Rights Advocacy, Disaster Relief, Environmental Conservation",Advocacy
1572,Person 1572,Media & Entertainment,"Videography, Influencer Marketing, Sound Engineering, Advertising, Media Planning","Digital Media, Music Production, Social Media Content, Videography",Broadcasting
1573,Person 1573,Healthcare & Life Sciences,"Nutritional Counseling, Biomedical Engineering","Bioethics, Patient Advocacy, Genomics, Nursing",Healthcare IT
1574,Person 1574,Consumer Goods & Retail,"Procurement, Supply Chain Logistics, Product Management","Customer Experience Design, Sustainable Consumer Goods, Brand Management",Apparel & Footwear
1575,Person 1575,Engineering & Manufacturing,"Manufacturing Engineering, Product Development, Construction Management, Supply Chain Management, Piping Design","Electrical Systems, Mechanical Design, Renewable Energy, Robotics Engineering",Product Design
1576,Person 1576,Healthcare & Life Sciences,"Clinical Research, Nursing, Healthcare Data Analysis","Nutrition, Healthcare Policy, Telemedicine, Health Informatics",Telemedicine
1577,Person 1577,Technology & IT,"Software Testing, Web Development, IT Support","Digital Transformation, Open Source Projects, Big Data",Web Development
1578,Person 1578,Technology & IT,"SQL, DevOps","Tech Blogging, 3D Printing, Web Development, System Architecture",Big Data
1579,Person 1579,Legal & Compliance,"Employment Law, Legal Research","Environmental Law, Ethics, Intellectual Property",Litigation
1580,Person 1580,Legal & Compliance,"Environmental Law, Data Privacy, Legal Consulting, Corporate Governance","Legal Research, Human Rights Law, Corporate Law, Consumer Protection",Contract Management
1581,Person 1581,Media & Entertainment,"Videography, Animation, Content Creation, Brand Storytelling, User Engagement","Film & Cinema, Cultural Events, Photography, Animation",Public Relations
1582,Person 1582,Government & Non-Profit,"Legal Compliance, Public Administration","Disaster Relief, Community Development",NGO
1583,Person 1583,Finance & Banking,"Asset Management, Forecasting, Fraud Detection, Tax Planning","FinTech Innovation, Risk Management",Accounting
1584,Person 1584,Engineering & Manufacturing,"Process Engineering, Thermodynamics","Robotics Engineering, Civil Infrastructure",Product Design
1585,Person 1585,Media & Entertainment,"Videography, Influencer Marketing, Video Editing, Public Relations","Music Production, Digital Media, Videography, Social Media Content",Journalism
1586,Person 1586,Media & Entertainment,"Broadcasting, Campaign Management, Event Planning","Podcasting, Creative Writing, Journalism",Music Industry
1587,Person 1587,Hospitality & Travel,"Reservation Management, Cruise Management, Event Planning, Tourism Management, Customer Service","Luxury Travel, Cultural Tourism, Event Management, Travel Planning",Travel Agencies
1588,Person 1588,Education & Training,"Education Policy, Classroom Management, Teacher Training","Lifelong Learning, E-learning, Vocational Training, Curriculum Development",Educational Technology
1589,Person 1589,Engineering & Manufacturing,"Robotics, Thermodynamics, 3D Printing","Civil Infrastructure, Robotics Engineering",Manufacturing
1590,Person 1590,Energy & Utilities,"Renewable Energy, Sustainability, Smart Grid Technology, Drilling Engineering, Energy Management","Renewable Energy, Climate Change Mitigation",Environmental Engineering
1591,Person 1591,Transportation & Logistics,"Import/Export Management, Logistics Analysis, Demand Planning, Route Planning","Sustainable Transport, Maritime Logistics, Cold Chain Logistics",Aviation
1592,Person 1592,Real Estate & Construction,"Contract Negotiation, Surveying, Construction Safety, Real Estate Development, Commercial Real Estate","Construction Technology, Landscaping, Urban Development",Construction Management
1593,Person 1593,Finance & Banking,"Financial Regulations, Wealth Management, Auditing","Economic Trends, Banking Technology, FinTech Innovation",Real Estate Investment
1594,Person 1594,Real Estate & Construction,"Contract Negotiation, Zoning & Land Use, Site Management, Residential Real Estate","Real Estate Law, Commercial Real Estate, Sustainable Architecture",Construction Management
1595,Person 1595,Hospitality & Travel,"Hotel Operations, Catering, Food & Beverage Management","Tourism, Hospitality Innovation, Adventure Travel",Recreation & Leisure
